篇名,作者,关键词,摘要,没有引进词表的jieba提取的中药材,引进词表的jieba提取的中药材
黄芪等药食同源类中药作为功能性食品与肠道菌群的相互作用,"田雨,丁艳平,邵宝平,杨晶,吴建国","黄芪,药食同源,功能性成分,肠道菌群,中草药功能性食品","中草药是我国文化的瑰宝,中医理论是中国传统医学的核心,其中的许多理念都可以与现代食品工业中的功能性食品概念得到统一与平衡.自古人们便发现药品与食品有同一来源,现如今,药食同源概念已被大众广泛接受,黄芪等多味中药被先后列入药食同源目录中,药食同源类中药中含有丰富的生物活性物质,可作为特色资源被开发成相关功能性食品,实现传统医学与现代理念的结合.黄芪中的主要功能性成分——黄酮类、多糖类和皂苷类能通过影响肠道菌群的种群结构、代谢以及肠道细胞功能等方式维持肠道微环境稳态,进而影响人体健康;另一方面,肠道菌群也参与这些活性成分在体内的吸收、代谢、转化等各个步骤,对其功效的发挥产生影响,提高其生物利用度,是生物活性物质发挥功效相关机制中必不可少的角色.该文主要对黄芪中的黄酮类、多糖类和皂苷类活性成分与肠道菌群的相互作用做一综述,同时列举出其他药食两用中药中的这种主要功能成分与肠道菌群的相互作用方式,进行概括,为黄芪等药食同源类中药作为功能性食品原料的功效机制及新产品应用与开发方面提供理论基础,并对黄芪等药食同源类中草药功能性食品的未来发展提出建议与展望.",黄芪,黄芪
药食同源植物葛根的研究进展,"董彐倩,梅瑜,王继华,黄能旭,蔡时可","药食同源,葛根,化学成分,食品开发,育种","葛根营养丰富,是一种重要的药食同源植物,可开发为多种药用和保健食品,市场前景广阔.综述了葛根资源与分布、化学成分、药用历史、食品开发与利用、育种栽培等方面的研究进展,以期为葛根的研究及开发利用提供参考.",葛根,葛根
防治冠心病药食同源类中药配伍研究,"盛蒙,陈瑞,田维毅","冠心病,药食同源类中药,用药规律,关联规则","目的:分析近十年来药食同源类中药防治冠心病的应用及配伍规律.方法:检索中医临床诊疗文献数据库、中国知网,筛选-年治疗冠心病的临床文献,运用频数统计和关联规则分析的Apriori算法分析防治冠心病的中药及药食同源类中药性味归经、高频药对及其配伍规律.结果:共纳入篇临床文献,首方剂,味中药.临床治疗冠心痛最常用的味中药为丹参、黄芪、川芎、红花、瓜蒌;最常用的味药食同源类中药为甘草、当归、桃仁、人参、薤白、桔梗.结论:防治冠心病的药食同源类中药以补气活血养血类中药为主,药性平和.","丹参, 黄芪, 川芎, 红花, 瓜蒌, 甘草, 当归, 桃仁, 人参, 薤白, 桔梗","丹参, 黄芪, 川芎, 红花, 瓜蒌, 甘草, 当归, 桃仁, 人参, 薤白, 桔梗"
不同产地六种药食同源药材中重金属及农药残留的测定,"吴诗惠,杨军,朱宁,王剑波","不同地域,药食同源,药材,重金属,农药残留","目的:对不同地域的种药食同源药材中重金属及农药残留进行测定,为药材的安全性评价和监管及相应措施的实施提供科学依据.方法:参照《中国药典》年版中检测方法,运用微波消解-电感耦合等离子体质谱法对药材中重金属铅、砷、镉、汞、铜残留进行含量测定,运用气相色谱法对药材中有机氯农药残留进行检测,并与《中国药典》年版、《GB-食品中污染物限量》、《WM/T-药用植物及制剂外经贸绿色行业标准》及《GB-食品中农药最大残留限量》等法典或标准中重金属及农药残留限量对比,评价不同地域的污染状况及药材品质.结果:根据重金属及农药残留检测方法测得不同地域的种药食同源药材均未超出《中国药典》年版中规定的重金属及农药残留的限度,但其中样品、的砷含量均大于.mg·kg-,样品、、、、、、、的镉含量均大于.mg·kg-,均超出《GB-食品中污染物限量标准》中的污染物限量.结论:我国镉和砷污染状况仍然严峻,全面禁止有机氯农药的使用初显成效,药食同源药材的监测力度有待提升.",铅,铅
加速溶剂萃取-QuEChERS-超高效液相色谱-串联质谱法测定药食同源性食品中种真菌毒素,"方真,曲栗,古淑青,陈柔含,李优,邓晓军,郭德华,冯峰","超高效液相色谱-串联质谱,加速溶剂萃取,QuEChERS,真菌毒素,药食同源性食品","建立了加速溶剂萃取-QuEChERS-超高效液相色谱-串联质谱测定药食同源性食品中种真菌毒素的方法.样品经过加速溶剂萃取后用QuEChERS方法净化,液相色谱分离,在正、负离子同时扫描和多反应离子监测模式下检测,黄曲霉毒素B和伏马毒素B采用内标法定量,其余毒素采用基质外标法定量.在较宽的线性范围内,种目标化合物的线性相关系数(r)均大于..该方法的检出限为.～.μg/kg,定量限为.～.μg/kg,在个不同添加水平下的加标回收率为.％～％,RSD为.％～.％.采用建立的方法分别对市面上销售的个批次的山银花、葛根和沙棘产品进行检测,部分产品检出不同含量的真菌毒素.该方法快速、灵敏,适用于药食同源性食品中多种真菌毒素的同时检测.","银花, 葛根, 沙棘","银花, 葛根, 沙棘"
基于中医“治未病”理论筛选预防新型冠状病毒肺炎的“药食同源”类中药,"宋成,刘君君,姚诗文,孙佳彬,侯建明,冯秀芝,单国顺","药食同源,中药预防,新型冠状病毒肺炎","目的:在国家卫生健康委员会公布的按照传统药食同源中药材目录中筛选抗新型冠状病毒肺炎中药,在疫情期间为人们提供科学可靠的预防新型冠状病毒肺炎的“药食同源”类中药.方法:对自疫情以来通过中药预防新型冠状病毒肺炎感染的相关文献报道进行综述,并通过近期我国个省市卫生健康委员会发布的《新型冠状病毒感染的肺炎中医药预防方案》中提供的预防性药方,结合按照传统既是食品又是中药材物质目录,搜集整理具有抗病毒、增强机体免疫力的“药食同源”类中药.结果:通过筛选及梳理得到具有抗新型冠状病毒的“药食同源”中药九味.结论:桑叶、菊花、黄芪、青果、桔梗、金银花、藿香、甘草、百合(鲜百合)九味中药,符合中医药理念中“治未病”和“药食同源”的思想,可以应用于预防新型冠状病毒肺炎.","桑叶, 菊花, 黄芪, 青果, 桔梗, 金银花, 藿香, 甘草, 百合","桑叶, 菊花, 黄芪, 青果, 桔梗, 金银花, 藿香, 甘草, 百合"
种降血压药食同源原料研究进展及展望,"何嘉敏,于新,刘学云,王仲芬,唐树森","药食同源,功能性成分,食品,降血压机制","依据我国卫生部颁布的药食同源物品名录,从膳食疗法的角度阐述了莱菔子、山楂、菊花、葛根、决明子、牡蛎、木瓜、佛手、核桃仁和昆布种具有降血压功能的药食同源原料中功能性成分及其降血压机制;概述了降血压食品的发展现状,并指出药食同源降血压食品开发前景和方向.","莱菔子, 山楂, 菊花, 葛根, 决明子, 牡蛎, 木瓜, 佛手, 核桃仁, 昆布","莱菔子, 山楂, 菊花, 葛根, 决明子, 牡蛎, 木瓜, 佛手, 核桃仁, 昆布"
三七的临床应用与药食同源使用现状,"韩倩,陈勇,魏江存,黄周艳,刘玟君,陈良妮","三七,临床应用,药食同源","三七是一种十分常见的化瘀止血类药材,对三七的称谓有田七、山漆、金不换等.从古至今历代医家都对三七的使用有不同见解,其主要用于跌打损伤、出血诸症,“止血不留瘀,化瘀不伤正”也得到各派医家的认同,并享有“止血神药”之美誉.三七不仅可以用于医疗,也可以成为百姓的食材之一,中医对食用三七还有着“生打熟补的说法.综述了最近十年来关于三七在临床方面的应用以及三七药食同源的使用情况.","三七, 金不换","三七, 金不换"
浅谈药食同源食品蒲青琰植物固体饮料的应用,"鲍新,林玉惠,袁如英","药食同源,阴阳平衡,植物固体饮料","中医素有""药食同源""之说,表明医药与饮食属同一个起源.利用蒲公英、青果、鱼腥草、马齿苋、茯苓、金银花、山楂、罗汉果、益智仁、甘草、鸡内金、陈皮、鲜芦根、菊花、莲子、桔梗、葛根、紫苏等十八位味法定药食同源中药,开发出具有解表散寒、清热解毒、润喉生津、健脾温固的""阴阳平衡""药食同源植物固体饮料.","蒲公英, 青果, 鱼腥草, 马齿苋, 茯苓, 金银花, 山楂, 罗汉果, 益智仁, 甘草, 鸡内金, 陈皮, 芦根, 菊花, 莲子, 桔梗, 葛根, 紫苏","蒲公英, 青果, 鱼腥草, 马齿苋, 茯苓, 金银花, 山楂, 罗汉果, 益智仁, 甘草, 鸡内金, 陈皮, 芦根, 菊花, 莲子, 桔梗, 葛根, 紫苏"
药食同源新配方液体KH-的抗病毒作用和安全性研究,"代岩,景世钰,吴杰军,陈景才,赵软金","药食同源,抗病毒,安全性","目的测试药食同源中药材新配方制成的液体KH-的抗病毒作用,并研究其安全性.方法组方选择金银花、菊花、菊苣、蒲公英、代代花、甘草、砂仁、淡竹叶为原料,通过八种药食同源中药材不同的配比及相应的制备工艺制备成液体KH-.进行体外细胞学实验证实其抗病毒作用,并测试其急性经口毒性、遗传毒性、天经口毒性.结果体外细胞学实验结果表明,KH-具有明显的广谱抗病毒作用,并且没有急性经口毒性、遗传毒性、天经口毒性.结论以金银花、菊花、菊苣、蒲公英、代代花、甘草、砂仁、淡竹叶为原料通过一定的制备工艺制得的液体KH-在细胞学实验中具有广谱抗病毒作用,并且是安全的.","金银花, 菊花, 菊苣, 蒲公英, 甘草, 砂仁, 淡竹叶","金银花, 菊花, 菊苣, 蒲公英, 甘草, 砂仁, 淡竹叶"
基于现代文献探讨干预血脂异常的药食同源类药物用药特点及其病机分析,"葛肖波,薛晓琳,李鑫,李宁","血脂异常,药食同源中药,用药特点,病机,中医传承辅助平台","目的通过对文献的研究,探讨干预血脂异常的药食同源中药的用药特点,并对其进行病机分析.方法检索中文数据库(知网、万方、维普)筛选—年间血脂异常的临床文献,借助""中医传承辅助平台V."",以年卫健委公布的种药食同源中药为对照,对数据进行频次、关联规则分析,按通用教材对药食同源中药的药效、性味和归经进行统计分析,基于统计结果探讨药食同源中药干预血脂异常的用药特点,并对其进行病机分析.结果药食同源中药味(占常用味的.％),出现频次为次(占味中药出现次数的.％);出现频次≥次的药食同源中药共味(占味药食同源中药的.％),出现频次为次(占味药食同源中药出现次数的.％),按频次由高到低排序依次为山楂、茯苓、决明子等;发掘出组治疗血脂异常的药食同源中药组合;干预血脂异常的药食同源中药药味以甘为主,药性以平为主,归脾经的药物最多.结论药食同源中药干预血脂异常多以健脾为基本治则,兼以祛湿化痰、活血化瘀,常用药食同源中药为山楂、决明子、茯苓等,可将这些药物用于血脂异常的日常保健与临床防治.","山楂, 茯苓, 决明子","山楂, 茯苓, 决明子"
一款药食同源马蹄糕的研制,"李淼,谢梦洲,陈禧音,付琴,曹海琳","药食同源,马蹄糕,清热,配方","以药食同源药物和马蹄粉为主要原料并配以辅料,以感官评分为指标,考查中药汁、梨汁、柠檬汁及马蹄粉添加量对马蹄糕品质的影响,采用单因素试验及正交试验确定配方.结果表明,最佳配方为中药汁mL(灰树花g,山药g,茯苓g,黄芪g,藕g,葛根g,党参g,甘草g,加水mL,浸泡min,煎煮min),梨汁mL,柠檬汁mL,马蹄粉g.按照最佳配方研制出的马蹄糕性状稳定、颜色均匀、口感风味良好.","树花, 山药, 茯苓, 黄芪, 藕, 葛根, 党参, 甘草","树花, 山药, 茯苓, 黄芪, 藕, 葛根, 党参, 甘草"
药食同源降血脂食品原料的研究及应用进展,"刘学云,于新,何嘉敏,王仲芬,唐树森","药食同源,降血脂,高血脂症","阐述了葛根、蒲公英、桑叶、决明子、山楂、山药、紫苏、荷叶、莱菔子、薏苡仁、红曲等种常见的药食同源原料中可控制和治疗高血脂症的有效成分,探讨了其降血脂的作用机制;综述了对药食同源中药为原料的降血脂食品的研究和发展现状,指出了药食同源降血脂食品开发中有待进一步研究和亟待解决的问题,为药食同源降血脂食品的开发和利用提供理论参考.","葛根, 蒲公英, 桑叶, 决明子, 山楂, 山药, 紫苏, 荷叶, 莱菔子, 薏苡仁, 红曲","葛根, 蒲公英, 桑叶, 决明子, 山楂, 山药, 紫苏, 荷叶, 莱菔子, 薏苡仁, 红曲"
药食同源莲子的应用研究进展,"张超文,谢梦洲,王亚敏,向茗,朱建平,肖作为","莲子,药食同源功能,中医药,保健食品","莲子营养价值丰富,既可药用又可食用,为“药食同源”产品之一.自古以来,莲子都是人们喜爱的滋补品,不仅补益效果佳、来源方便,还可以根据不同的搭配制作出多种类型的莲子保健产品.随着研究的深入,莲子的应用范围日益广泛,已渗透到中医药、保健食品开发、日化用品研发中,且市场开发前景巨大.",莲子,莲子
五种药食同源花提取物体外协同抗氧化作用,"余祥雄,梁泽明,肖性龙,余以刚","药食同源花,复配物,DPPH,溶血,协同效应","通过,-二苯基--三硝基苯肼(,-diphenyl--picrylhydrazyl,DPPH)自由基清除试验和,-偶氮二(-甲基丙基咪)二盐酸盐(,-azobis-(-amidinopropane)dihydrochloride,AAPH)诱导红细胞溶血试验评价菊花、金银花、槐花、代代花、白扁豆花水提物和水提物的复配物(菊花％,槐花％,白扁豆花％,代代花％,金银花％)的抗氧化性,并讨论五种药食同源花的协同抗氧化作用.结果表明五种药食同源花的提取物及其复配物均具有一定程度的抗氧化能力.在DPPH体系中,根据自由基的半数清除率(IC值),各提取物抗氧化能力大小顺序为复配物(IC=.μg/mL)＞槐花(IC=.μg/mL)＞菊花(IC=.μg/mL)＞金银花(IC=.μg/mL)＞代代花(IC=.μg/mL)＞白扁豆花(IC=.μ,g/mL),复配物表现出明显的协同抗氧化效果.AAPH诱导红细胞溶血体系中,复配物和槐花提取物表现出很强的溶血抑制作用,而金银花、菊花、代代花以及白扁豆花提取物仅表现出较弱的抑制作用.剂量在～μg/mL时槐花提取物对红细胞的溶血抑制率小于复配物,当剂量达到μg/mL时,槐花提取物和复配物对红细胞的溶血抑制率分别为.％±.％和.％±.％,这说明五种药食同源花提取物之间存在协同抗氧化作用.","菊花, 金银花, 槐花, 白扁豆","菊花, 金银花, 槐花, 白扁豆"
变换波长HPLC法同时测定药食同源降脂片中橙黄决明素、芦丁和槲皮素含量,"陈静,丁洁,沙芮,李瑞宾,牛犇","高效液相色谱法(HPLC),橙黄决明素,芦丁,槲皮素,药食同源降脂片",采用GeminiC色谱柱(.mm×mm袁μm)袁流速为mL/min袁柱温℃袁波长切换(~min袁在nm波长下检测芦丁袁~min袁在nm波长下检测槲皮素和橙黄决明素)袁进样量μL袁流动相为甲醇(A)-水(B).结果表明袁橙黄决明素在.~.μg/mL(R＝.)线性关系良好袁平均回收率为.%袁RSD为.%;芦丁在.~.μg/mL(R＝.)线性关系良好袁平均回收率为.%袁RSD为.%;槲皮素在.~.μg/mL(R＝.)线性关系良好袁平均回收率为.%袁RSD为.%.药食同源降脂片中橙黄决明素平均含量.mg/g袁RSD为.%;芦丁平均含量.mg/g袁RSD为.%;槲皮素平均含量.mg/g袁RSD为.%.该方法操作简便、准确、稳定、重复性好袁可用于药食同源降脂片的质量控制.,槲皮,槲皮
药食同源一岷县当归产业发展的新突破点,张建强,"当归食品,药食同源,当归产业,当归饮食文化","为了增加当归消费新需求,依据当归功效和药食同源思想,提出了开发当归食品的思路和推广建议.开发思路主要包括:充分挖掘中医食疗宝库,搜集民间传统的当归食品;运用现代生命科学研究成果,设计效果确切的当归食品;与大企业合作,联手开发当归食品;与日常食品和饮品相结合,开发当归系列食品.推广建议主要是:颠覆当归仅仅为中药材的传统观念,打造当归饮食文化;充分利用现有销售渠道,通过当归食品推广当归饮食文化;通过电视台、网络媒体积极传播当归饮食文化.",当归,当归
种食药同源植物提取物对果蔬常见腐败菌的抑菌活性研究,"郭俊花,张增帅,马欣,成少宁","食药同源,果蔬,腐败菌,抑菌","本文以花椒、高良姜等种食药同源植物提取物为供试材料,分别研究了其对扩展青霉、灰葡萄孢、链格孢和大肠杆菌、金黄色葡萄球菌等种常见果蔬腐败菌的抑制作用.结果表明,花椒对三种霉菌抑制作用最强,高良姜和莱菔子对扩展青霉和链格孢有一定抑制作用.花椒对三种霉菌的最小抑菌浓度分别为.、.、.mg/mL,最小杀菌浓度分别为.、.、.mg/mL.花椒对三种霉菌的孢子萌发有显著抑制作用.花椒提取液处理樱桃番茄可显著降低果实发病率,延长果实保鲜期.种食药同源植物提取液对大肠杆菌抑菌效果较差.高良姜和天麻对金黄色葡萄球菌抑菌效果突出,可显著抑制金黄色葡萄球菌生长,二者对金黄色葡萄球菌的MIC分别为.和.mg/mL,MBC分别为.和.mg/mL.","花椒, 高良姜, 葡萄, 莱菔子, 樱桃, 番茄, 天麻","花椒, 高良姜, 葡萄, 莱菔子, 樱桃, 番茄, 天麻"
药食同源果树欧李分子水平研究进展,"韩红艳,杜俊杰","药食同源,欧李,凝集素","欧李(prunushumilisBge)是中国传统野生果树之一,与药用植物郁李同为蔷薇科樱桃属双子叶植物.欧李作为国家卫生部规定的药食同源植物有重要的研究价值,我们从""欧李、健康、生态""角度提出新问题,新概念、新理念、新技术、新发现.通过阅读文献和实际调查对其分子研究现状和内容进行了分析,重点以欧李凝集素为例对其食用和药用药用价值进行了阐释和展望.","樱桃, 李","樱桃, 李"
基于药食同源作物紫苏的屋顶绿化模式研究,"孙义新,张一,朱焰,李永,魏源,胡清","屋顶绿化,药食同源,紫苏,环境效益","采用药食同源作物紫苏代替传统绿化植物开展屋顶绿化试验,通过试验屋与对照屋的对比,探究了紫苏屋顶绿化模式的环境效益.结果表明:采用紫苏和复配土进行屋顶绿化时,产生的屋面荷载较低,符合屋顶绿化建筑的安全性原则;紫苏绿化具有很好的隔声降噪及隔热保温效果,同等情况下,试验屋内噪声级相较对照屋平均降低.dB,白天试验屋内气温最高可降低.℃,夜间则对室内产生.℃的保温效果;紫苏叶片对空气中浮尘具有一定的吸附效果;通过采用具有经济附加值的紫苏开展屋顶绿化,可以有效开发屋顶的经济价值.","紫苏, 紫苏叶","紫苏, 紫苏叶"
河北省药食同源大豆产业发展现状及对策,"胡春芳,李敏*,冯改静","河北省,药食同源,大豆,种植面积,产量,加工企业,发展现状,存在问题,建议","对河北省药食同源大豆产业的种植生产情况、加工企业现状进行分析,发现存在的问题,以期提出大豆产业发展的建议.利用文献调研、实地调研和专家访谈的情报分析方法,从大豆种植面积、单产水平、年总产量以及大豆加工企业情况方面,对河北省药食同源大豆产业的发展现状进行分析.结果表明:河北省大豆种植面积呈逐年下滑趋势,从年的hm减少到年的hm,减少了.%;单产水平基本呈平稳增长趋势,年单产水平已经达到了kg/hm;大豆总产量呈曲线下降趋势,从年的t下降到年的t,其中年总产量最低(t).河北省大豆加工食用品以初级加工农产品和传统加工产品为主,新兴大豆制品品种较少;加工的大豆保健品主要是大豆卵磷脂和大豆低聚糖.河北省大豆加工企业存在着产业链条短、深加工层次较浅、大型龙头企业较少、大豆加工原料不足等问题.并对河北省药食同源大豆产业的发展提出了相应对策.",低聚糖,低聚糖
凯里市药食同源植物资源调查研究,"雷启义,谢峰,周江菊,张文华,李性苑","凯里,药食同源植物,传统知识,药用植物,民族植物学","凯里地区苗族食用和药用同一植物防治疾病的现象较为普遍.为了掌握这类药食药同源植物资源和相关传统知识的现状.本研究运用民族植物学的方法进行实地调查,共记录药食同源植物种,隶属科属,其中数量最多的是唇形科,共有种;其次为蔷薇科,共种,再次为百合科、豆科、马齿苋科、菊科植物,每科各有种,其余的均为每科种.木本类有种,草本类种,草本类为苗族药食同源植物的主要类群,食用以叶和果实为主,药用以全草为主,这类植物主要是防治消化系统、血液循环系统和免疫系统等疾病.少数民族地区药食同源植物资源和相关传统知识非常丰富,需要深入地调查和研究,保护性开发这类深藏在少数民族民间利用药食同源植物的宝贵传统知识,更好地为人类的健康服务.",马齿苋,马齿苋
种药食同源中药治疗桥本甲状腺炎的研究进展,"李媛媛,周鸿铭,唐小牛","药食同源,中药,桥本甲状腺炎","随着桥本甲状腺炎的发病率逐年提高,药食同源药材既能作为药品又能作为食品,安全性高可以长期服用.文章对卫计委公布的《既是食品又是药品的物品名单》进行分类总结,以《中国药典》为依据,选出种具有治疗桥本甲状腺炎作用的药食同源中药:夏枯草、蒲公英、人参,并总结这种中药近年来治疗桥本甲状腺炎的实验研究和部分临床治疗效果,为进一步预防和治疗桥本甲状腺炎以及对桥本甲状腺炎患者的日常饮食指导起到积极作用.","夏枯草, 蒲公英, 人参","夏枯草, 蒲公英, 人参"
药食同源品种中重金属及有害元素的风险评估,"左甜甜,金红宇,屈浩然,张磊,孙磊,李静,马双成","中药材,药食同源,重金属元素,有害元素,风险评估,最大限量理论值,质量控制,中国药典","目的测定种药食同源品种中重金属及有害元素,通过风险评估制订其限量.方法采用电感耦合等离子体质谱(ICP-MS)法对全国范围内收集到的鱼腥草等批种药食同源品种中重金属及有害元素的残留量进行测定和分析,按照风险评估的基本步骤,对其重金属及有害元素的风险进行确定性评估,并计算其重金属及有害元素的最大限量理论值.结果批药食同源品种中,整体合格率为.％;其中,枸杞子、木瓜、酸枣仁、玉竹和乌梢蛇全部合格,菊花、肉桂、鱼腥草和山银花合格率分别为.％,.％,.％和.％;除了鱼腥草外,其他个药食同源品种风险可控,鱼腥草作为膳食的健康风险需要被关注;最大限量理论值的计算结果表明,年版《中国药典》中枸杞子铅和砷的限量大于其最大限量理论值,食品国标GB-中菊花和山银花中铅的限量大于最大限量理论值,其余限量合理.结论该方法可用于药食同源品种中重金属及有害元素的风险评估,建议以风险评估为指导,建立适用于药食同源品种使用特点的残留限量标准.","鱼腥草, 枸杞子, 木瓜, 酸枣仁, 玉竹, 乌梢蛇, 菊花, 肉桂, 银花, 铅","鱼腥草, 枸杞子, 木瓜, 酸枣仁, 玉竹, 乌梢蛇, 菊花, 肉桂, 银花, 铅"
药食同源蒲公英的栽培技术及其应用研究进展,"陈梦妮,王慧,李永山,范巧兰,秦欣","药食同源,蒲公英,栽培技术,药理作用,开发前景","蒲公英在我国分布广泛,因其独特的营养价值和药理作用,已明确归类为""药食同源物品"".基于前人研究介绍了蒲公英的形态特征,分析了品种筛选、外界环境的影响、田间管理、反季设施栽培技术和组织培养技术的概况,阐明了蒲公英活性物质的抗炎抑菌、抗氧化和抗肿瘤的药理作用.其可用于生产药品、食品、日用品、化妆品等多样化的工业产品,同时也可作为饲料添加剂,对牛、马、羊、家禽等具有保健作用,市场潜力巨大.",蒲公英,蒲公英
