篇名,作者,关键词,摘要,没有引进词表的jieba提取的中药材,引进词表的jieba提取的中药材
黄精多糖的结构分析及功能活性研究进展,"李丽,田丽娜,任振兴,龙子江","黄精多糖,结构分析,功能活性","黄精是一种传统的药食同源类中药,具有补气养阴、健脾、润肺、益肾等功能,主要含有多糖、甾体皂苷、蒽醌类化合物、生物碱、强心苷、木质素、维生素等化合物,而黄精多糖是黄精的主要活性成分.近年来,黄精多糖的组成结构分析及其功能活性的研究取得了很大的进展,本文通过查阅国内外相关文献,对黄精多糖的主要化学组成及其分子量测定、结构分析及功能活性进行系统的归纳,结果显示黄精多糖的化学组成主要有阿拉伯糖、半乳糖、葡萄糖、甘露糖、果糖和半乳糖醛酸,以及少量的木糖和葡萄糖醛酸;在药理活性方面,其具有一定的抗肿瘤、抗氧化与抗衰老、提高免疫力、调节血糖血脂、抗菌抗炎及调节细胞内分泌等作用,具有广泛的应用价值及市场前景.但是,缺少黄精多糖化学组成及其体内、体外生物学作用及机制的研究,因此,本文将对其应用前景进行讨论与展望,提出进一步的研究方向,为其保健品的开发及疾病的治疗提供理论依据.",黄精,黄精
黄精多糖研究综述,"徐兵兵,于勇杰,吴帆,倪穗","黄精,多糖,组成,提取,含量,功能特性",黄精是我国传统的中草药，属于药食同源性药材。黄精多糖作为黄精的一种重要药用成分，具有多种生理功效。本文就近期我国学者对黄精多糖的化学组成、含量测定方法、提取方法、主要功能特性等方面的研究进行了分析总结，对黄精多糖的的研究前景进行了展望，以期为黄精多糖的开发利用提供参考。,黄精,黄精
山楂的现代研究特点分析,"王坦,苗明三,苗艳艳","山楂,化学成分,药理作用,临床应用",山楂含有有机酸、三萜类化合物、黄酮类化合物、多糖等多种活性成分，具有保护心脑血管、抗菌、抗氧化、降血压、降血脂、抗肿瘤等药理作用。临床上常以山楂作为助消化的食疗产品。山楂作为药食同源的植物，应积极开发其在临床以及保健类食品等方面的应用，加大对山楂叶的开发利用。,"山楂, 山楂叶","山楂, 山楂叶"
间接竞争酶联免疫吸附法快速筛检莲子中黄曲霉毒素B的污染水平,"褚先锋,豆小文,孔维军,杨美华,赵翀,赵明,欧阳臻","莲子,黄曲霉毒素B,快速筛检,间接竞争-酶联免疫吸附法,液质联用法","建立间接竞争酶联免疫吸附法(ic-ELISA)快速筛检“药食同源”中药-莲子中黄曲霉毒素B(AFB)的污染水平,并采用超快速液相串联质谱(UFLC-MS/MS)进行结果确证.通过基质匹配,AFB在.～.μg·L-线性关系良好(R＞.),半数抑制浓度(IC)为.μg·L-,加样回收率为.％～.％,RSD＜％,检测限(IC)为.μg·L-.将ic-ELSIA法应用于批莲子中AFB的筛查,结果显示:于℃,％湿度条件下贮藏一年的～号样品中AFB污染水平为.～.μg·kg-,％样品中AFB含量超过限量标准(μg·kg-);新购买的～号样品中AFB污染率为％.以上结果经液质联用技术确证,通过计算ic-ELISA和液质测定结果之间的皮尔森相关系数可知,二者测定结果的匹配度达..建立的ic-ELISA分析方法操作简便、灵敏、结果准确,可用于莲子中AFB的高通量现场快速检测.",莲子,莲子
桑叶黄酮类化合物研究进展,"李飞鸣,张国平,邹湘月,邵元元,艾均文","桑叶,黄酮类化合物,活性成分,药理作用,进展,展望","桑叶作为“药食同源”的重要植物资源,具有抗肿瘤、抗衰老、降血糖、降血压、降低胆固醇等多种药理作用,为一种广泛使用的传统中药.黄酮类化合物是桑叶中重要的活性成分,本文围绕桑叶黄酮类化合物在不同桑树品种、不同发育时期及加工过程中的动态变化、提取方法、药理作用等方面的研究成果进行综述,并展望相关研究与应用方向,为桑叶中黄酮类化合物的更好地开发利用提供参考.",桑叶,桑叶
水生蔬菜营养及药用价值研究进展,"李效尊,尹静静,杜绍印,杨百战,刘蓬,吴修","水生蔬菜,营养成分,药用价值","水生蔬菜包括莲藕、茭白、慈姑等余种水生植物,据中医药典记载水生蔬菜大多为药食同源植物.对近年来水生蔬菜的营养成分及药用价值相关研究进展进行了综述,以促进人们对水生蔬菜价值的了解,并为水生蔬菜产品的综合开发利用提供参考.","茭白, 慈姑","茭白, 慈姑"
苦瓜多糖的提取、结构及生物活性研究进展,"龚斌,申明月,何陵玲,谢建华","苦瓜多糖,分离纯化,理化性质,结构,生物活性","苦瓜是一种药食同源瓜果,已有上千年的食用历史,现代研究发现苦瓜多糖是苦瓜中主要的生物活性物质之一.苦瓜多糖是一种复合杂多糖,研究发现其具有许多生物活性.本文从苦瓜多糖的提取、分离纯化、理化性质及结构特性、生物活性等方面对其研究进展进行了较为系统的介绍与分析,并对苦瓜多糖的研究前景进行了展望.","苦瓜, 杂","苦瓜, 杂"
菊花挥发油主要成分对肿瘤抗性的研究进展,"周晓叶,蒋细旺,镇鸿燕","菊花,挥发油,萜类,抗癌,小白菊内酯,β-榄香烯",菊花作为药食同源植物，含有多种化学成分，具有多种药理活性。菊花中含有挥发油、黄酮、绿原酸、生物碱、多糖、氨基酸等化学成分，现代药理研究证明菊花具有多种功效，如抗癌、抗氧化、抗炎、抗病毒、抗菌等，并对心血管、免疫系统、神经系统有一定作用。菊花成分中的挥发油，证实能够对多种癌症有抵抗功效，对近几年菊花挥发油中的主要成分β-榄香烯、小白菊内酯及菊花三萜烯二醇和三醇、α-甜没药萜醇、棕榈酸等的抗癌功效研究进行综述，以明确挥发油成分的抗癌潜力。,"菊花, 没药, 棕榈","菊花, 没药, 棕榈"
落新妇苷研究进展,"杨婷婷,王万山,李树基","落新妇苷,分布,高效液相质谱,药物代谢动力学,离子通道,选择性免疫抑制","落新妇苷(astilbin,ASB)是一种广泛存在于多种植物和功能食品中的二氢黄酮醇苷,年由KzozHayashi首次从植物落新妇中提取得到,后陆续发现ASB存在于自然界多种植物中,如土茯苓,紫荆花,肿节风,葛根素等.ASB的植物多具有“药食同源”性,ASB也存在于许多功能性食物中,如龟苓膏,葡萄酒等.","落新妇, 土茯苓, 紫荆花, 肿节风","落新妇, 土茯苓, 紫荆花, 肿节风"
上海市虹口区-年腹泻病例沙门菌监测及分子型特征,"张静,沈静,唐漪灵,陈真,姚红,王斌,汤显,陈洪友,许学斌","感染性腹泻,沙门菌,主动监测,耐药性,分子分型",目的研究基于公共卫生实验室主动监测哨点医院沙门菌腹泻及优势菌型的耐药性和分子型特征。方法选择辖区内家医院作为主动监测哨点，甄别食源性感染性腹泻的病例并采集粪便标本进行沙门菌培养、血清型鉴定和抗菌药物耐药性试验，通过脉冲场凝胶电泳（PFGE）分析优势菌型的遗传同源性。结果—年，共检测份标本，分离沙门菌株（年度阳性率分别为．％、．％、．％，总阳性率为．％），涵盖种不同血清型，最常见的为肠炎和鼠伤寒沙门菌。所有沙门菌感染病例的男女性别比为．∶；肠炎和鼠伤寒沙门菌感染均以～岁（．％）和岁以上（．％）者居多。肠炎和鼠伤寒沙门菌对萘啶酸、磺胺异噁唑、链霉素、甲氧嘧啶、庆大霉素、四环素等种抗菌药物的耐药率分别为．％～．％和．％～．％，且肠炎沙门菌的耐药率显著高于鼠伤寒沙门菌（P值均＜．）。株肠炎和株鼠伤寒沙门菌经PFGE各自分为个和个分子型。结论肠炎和鼠伤寒是区域内最常见的沙门菌腹泻菌型，分子分型提示存在优势克隆的聚集性爆发和分散爆发，应警惕多重耐药的肠炎沙门菌克隆株形成潜在爆发的风险。加强以实验室为基础的主动监测对控制食源性感染性腹泻具有重要的公共卫生意义。,鼠,鼠
美味牛肝菌多糖的药理活性研究进展,"张新妍,林传燕,朱静","美味牛肝菌,多糖,免疫调节,抗肿瘤,抗氧化","美味牛肝菌是一种药食同源的珍贵野生真菌.近年来,多项研究结果显示牛肝菌提取物具有抗氧化、抗肿瘤以及免疫调节等药理活性,其中多糖组分是其具有多种药理活性的物质基础.综述了美味牛肝菌提取物多糖成分的药理活性研究进展,为进一步深入开发利用美味牛肝菌提供理论基础.",牛肝菌,牛肝菌
ICP-AES法测定南酸枣及其提取物中矿质元素含量,"翟宇鑫,陈军,李俶,刘继延,王谢祎,程超,刘成梅","南酸枣,矿质元素,电感耦合等离子体原子发射光谱法(ICP-AES),释放率",南酸枣作为一种分布广泛的药食同源植物，其营养活性成分的研究日益受到关注，然而关于其矿质元素的分布与体外释放情况的研究未见报道。采用电感耦合等离子体原子发射光谱法（ICP‐AES）测定了南酸枣皮、枣肉及其水提物、胃消化物中九种矿质元素含量。结果发现：枣肉中Fe，Ca，Zn，Mn，Al，Mg，Cu，K和P的含量分别为.，.，.，.，.，.，.，.，.μg·g－，低于枣皮中的含量，分别为枣皮含量的.％，.％，.％，.％，.％，.％，.％，.％，.％。南酸枣肉微波辅助水提物中Mn的释放率最高（.％），Fe最低（.％）；而枣皮中Zn的释放率最高（.％），Al最低（.％），除Fe，Zn和Cu外，南酸枣肉中其他各元素的释放率均显著高于枣皮。在模拟胃部消化后，南酸枣肉中矿质元素的释放率在.％～.％之间；枣皮中释放率在.％～.％之间，除Fe和Cu外，南酸枣肉各元素的释放率均显著高于枣皮。微波辅助提取更有助于南酸枣肉中Fe，Ca，Mn，Mg，K的释放，其释放率高于胃液消化。而胃液消化过程对枣皮的影响更显著，除Zn外，其他元素释放率均高于微波辅助水提。该实验结果明确了南酸枣肉及枣皮中矿质元素分布与释放的差异，为进一步研究南酸枣中矿质元素的人体吸收利用提供积极的指导作用。,"南酸枣, 酸枣肉","南酸枣, 酸枣肉"
香薷的化学、药理与临床应用特点分析,"李敏,苗明三","香薷,化学成分,药理作用,临床应用",香薷含有挥发油类、黄酮类、香豆素类等多种活性成分，具有抗病原微生物、消炎、解热、镇痛、解痉、增强免疫等药理作用，临床上常用于发汗解暑，行水散湿，温胃调中，夏月感寒饮冷，头痛发热，恶寒无汗，胸痞腹痛，呕吐腹泻，水肿，脚气等。香薷作为药食同源的植物具有广泛的应用性和广阔的应用前景，积极研究香薷的药用价值具有重要意义。,香薷,香薷
火麻仁的功效及食用安全性研究进展,"魏月媛,李理","火麻仁,化学组成,药理功能,毒副作用","火麻仁是一种使用历史悠久的药食同源植物,但因其含有一定量的大麻酚,使其在加工食品中的应用受到了一定程度上的质疑.从火麻仁的化学组成、功效作用及安全性等方面进行综述,充分证明火麻仁是非常优秀的食物来源及食品加工原料,还对存在的问题及未来的发展方向进行了讨论,为火麻仁资源的进一步开发利用提供了依据.",火麻仁,火麻仁
菊苣中苦味物质的研究进展,"张泽生,卢亚莉,高云峰,张云轩,王笑仪,张丽","菊苣,苦味物质,保肝作用,苦味食品开发","菊苣是药食同源的菊科菊苣属植物,原产于欧洲地中海地区、亚洲中部和北非,现广泛分布于世界各地.目前已在我国华北和山东地区大面积人工栽培.菊苣具有清肝利胆、健胃消食、利尿消肿等功效,还含有一般蔬菜中没有的苦味物质,如香豆素类物质马栗树皮素、马栗树皮苷、野莴苣苷,半萜类物质山莴苣苦素、山莴苣素,这些物质具有消炎、镇静、保肝等作用.其中倍半萜内酯是该属植物呈苦味和抗拒食活性主要原因.菊苣中倍半萜内酯成分显示出明显的保肝作用.菊苣作为一种宝贵的植物资源,其开发利用具有广阔的前景.除作为蔬菜、牧草和传统的咖啡替代品应用外,还可用于保健饮品、功能性食品等的研究开发.该文对菊苣中主要的苦味物质及目前的研究情况进行了归纳总结,为菊苣系列产品的研究与开发提供新的思路.","菊苣, 栗树皮, 莴苣, 山莴苣, 咖啡","菊苣, 栗树皮, 莴苣, 山莴苣, 咖啡"
小茴香化学成分及药理活性研究进展,"董思敏,张晶","小茴香,化学成分,药理活性,开发利用",小茴香是一种食药同源的植物，既是常用的调味品，也是传统的中药。通过查阅大量相关文献，对小茴香的化学成分、药理活性、开发利用研究现状进行综述，旨为小茴香的深入研究及其合理利用提供参考。,小茴香,小茴香
杨梅活性成分的药理作用与产品开发,"林旭东,凌建刚,朱麟,康孟利","杨梅,活性成分,药理作用,产品开发","杨梅是营养价值很高的药食同源食品,具有增强免疫力、调整肠胃功能、降血糖、降血脂、抗衰老、抗突变、抗肿瘤和增加血小板数量等功效,具有一定的开发价值.通过阐述杨梅活性成分的药理作用,综述了近年来国内外对杨梅加工产品的开发情况,同时对杨梅的发展前景进行了展望.",杨梅,杨梅
三七花菊花玫瑰茄复合饮料的研制,孙军涛,"复合饮料,三七花,菊花,玫瑰茄,稳定性",以三七花、菊花和玫瑰茄种药食同源材料为原料，通过单因素和正交试验研制一种具有降压功能的复合饮料。结果表明：该复合饮料的最佳配方为三七花提取液%、菊花提取液%、玫瑰茄提取液%、复合甜味料（白砂糖和蜂蜜的比例为∶）%；添加.%海藻酸钠，℃储藏时复合饮料稳定性最好。该功能性复合饮料呈酒红色，清亮透明，酸甜爽口，具有浓郁的玫瑰茄和菊花的芳香。,"三七花, 菊花, 白砂糖, 蜂蜜, 海藻, 酒","三七花, 菊花, 白砂糖, 蜂蜜, 海藻, 酒"
湖南道地白芷氨基酸含量与组成分析,"陈宏伟,钱玮,刁刻,饶力群,邱业先","白芷,氨基酸组成,游离氨基酸","白芷是我国常用中药材的一种,关于白芷镇痛的有效成分,主要认为是异欧前胡素、欧前胡素等香豆素类具有解痉、镇痛等作用的挥发油类化学成分,但白芷镇痛的成分及其机理尚不十分清楚,是否有其他物质也具有一定的药理作用也不得而知,比如说某些药效性氨基酸.该研究采用自动氨基酸分析仪测定了湖南道地茶陵白芷的蛋白质类氨基酸和游离氨基酸的含量,并分析其氨基酸组成.结果表明：总氨基酸检出除Asn以外的其他种蛋白质氨基酸,含量最高的Arg占总氨基酸的．％,接近/；必需氨基酸总量达．％,其中含量最高的是Leu,占总必需氨基酸的．％；药效氨基酸比例较高,在酸水解产物总氨基酸和游离氨基酸中分别达到．％和．％,其中Arg的含量最高,达．g·g-,占比为．％,游离氨基酸中γ-氨基丁酸、鸟氨酸含量也较高.此外,还含有少量的高半胱氨酸和鹅肌肽等游离非蛋白质氨基酸和短肽；必需氨基酸的组成接近WHO/FAO的建议摄入值,但Met＋Cys的RC值最小,为第一限制性氨基酸.这些药效性氨基酸和游离氨基酸可能是茶陵白芷具有良好药效的一个因素,而且茶陵白芷的氨基酸组成和配比较合理、符合人体需要,在强化含硫氨基酸的基础上具有开发成为新型药食同源保健性食品的潜力.研究结果可为进一步研究白芷的药理作用提供依据.","白芷, 前胡","白芷, 前胡"
特色野生蔬菜海州常山的开发利用,"宋婷,李翔,张颖,张应华,许俊强,吴金花","海州常山,野生蔬菜,利用现状,食药兼用","综述了珍稀的野生蔬菜资源海州常山的分布区域、植物学特性、应用现状及栽培技术,论述了海州常山在药用及园林绿化方面的功用,并展望了其未来的发展趋势,提出作为一种食药同源的木本野生蔬菜,海州常山开发利用市场发展空间巨大.",常山,常山
犬辣椒中毒治疗,"彭梦华,刘占斌",,辣椒又名秦椒、辣子、番椒等，是一年或多年生的茄科草本植物，为药食同源的植物，其作为药物和调味品有着悠久的历史。,辣椒,辣椒
红参价格波动分析,"张蕾,都晓春","红参,价格,H-P滤波","红参作为药食同源的特殊中药,被广泛应用于疾病的治疗与日常的保健,近年来,红参价格价格的高低直接关系到红参用药的可及性,给中药材种植者,药商、患者及中药材市场都带来了很大的影响,通过本文对红参价格波动的滤波分析,进而对红参价格进行预测,为中药材种植者及消费者提供参考.",红参,红参
蓝莓山药养胃、防醉,宁莉,,"蓝莓山药最好作为宴会的凉盘菜肴,其口感酸甜,具有开胃的作用._xD_
山药的营养价值_xD_
山药是典型的药食同源食材,有良好的益胃健脾等营养功效._xD_
山药因富含淀粉酶、多酚氧化酶等物质,可以增强脾胃动力,帮助消化食物.山药中富含的淀粉则使这道菜扮演了主食的角色,有很好的养胃、保肝、防醉酒的作用,是好酒人士的一道养生佳品.","山药, 酒","山药, 酒"
中药材白芷主要仓储害虫的绿色储藏技术研究进展,"罗舜,章文伟,徐广,杨永东,谭秋生,罗川,任星宇,邓才富","白芷,仓储害虫,绿色储藏","白芷是国家规定药食同源品种之一,广泛应用于中医药、食品、化妆品等产业,采用储藏技术代替硫磺熏蒸加工,符合安全、无污染、优质、营养的要求.该文总结了清洁卫生防治技术、低温和高温杀虫技术、辐照杀虫技术、生物防治技术和仓储害虫预测预报技术防治白芷主要仓储害虫的应用现状,为白芷的绿色储藏研究提供理论依据.",白芷,白芷
花粉抗高原反应和治疗心脑血管病,房柱,"花粉,高原反应,治疗,营养补剂,药物,多种疾病,运动员,向日葵,卫生部,天然物,抗衰老,化妆品,中医,制剂,增强,玉米,油菜,饮料,养生,同源","中医一直将花粉列为养生补益的重要药物.近年来,国外也用蜜源花粉作为营养补剂.我国卫生部批准玉米、油菜、向日葵、荞麦等八种常见花粉为食药同源天然物.目前,国内外将花粉做成各种制剂,用于抗衰老、增强运动员耐力并作为治疗多种疾病的药物和饮料、化妆品等.","花粉, 向日葵, 荞麦","花粉, 向日葵, 荞麦"
"冬吃海参,为健康提""参""",张三,,"冬季温补,健康提""参""_xD_
海参自古被认为是滋补佳品.《本草纲目拾遗》中就记载:""海参,味甘咸,补肾,益精髓,摄小便,壮阳疗痿,其性温补,足敌人参,故名海参.""_xD_
除了作为日常饮食的食材,中医讲求药食同源,海参也是一种优良的滋补食材.特别是到了冬季,人体阳气最弱,免疫力、抵抗力降低,此时吃点海参,能弥补体内阳气的不足.",海参,海参
何首乌的化学、药理及临床应用特点分析,"赵志浩,邢阿光","何首乌,化学成分,药理作用,临床应用",目的：何首乌中二苯乙烯苷、大黄素、大黄素甲醚、没食子酸和－羟甲基糠醛（－HMF）等化学成分，还含有还包含五味子素、儿茶素、B一谷甾醇、胡萝卜苷、没食子酸、苏氨酸、具有增强免疫、抗衰老、抗肿瘤、抗骨质疏松、抗菌、抗炎、保肝等作用。何首乌作为药食同源的中药，具有良好的药用及保健价值。,"何首乌, 五味子, 胡萝卜","何首乌, 五味子, 胡萝卜"
枸杞能防治脂肪肝,解玉明,,"枸杞是一种药食同源的常用中药,具有补肝益肾、养血明目以及抗衰老等功效.现代医学研究发现,枸杞还有护肝及防治脂肪肝的作用._xD_
原因是枸杞中含有一种有效成分——甜茶碱.它对治疗肝脏疾病有效.在枸杞的叶、果实和根皮里均含丰富的甜茶碱.药理实验表明,甜茶碱有抑制脂肪在肝细胞内沉积,促进肝细胞再生的作用.",枸杞,枸杞
“养生粉”吃有讲究莫随意,郑金美,,"祛湿排毒减肥,吃根豆粉;手脚冰凉,喝红豆薏仁粉;抗衰老乌发健脑,吃乌发粉;告别A罩杯,打造傲人丰姿,吃木瓜葛根茯苓粉……_xD_
近年来,从超市、农贸市场到网络上各种虚虚实实、大大小小的厂家、店铺,突然冒出各类养生粉,主要原料来自两大类:一类是五谷杂粮,主要有糙米、黑米、荞麦、燕麦、黄豆、红豆、绿豆、黑豆等;另一类是常见的药食同源食材,如黑芝麻、核桃、莲子、山药、红枣、麦芽、茯苓、杏仁、薏米等.","木瓜, 葛根, 茯苓, 荞麦, 燕麦, 绿豆, 黑豆, 黑芝麻, 莲子, 山药, 红枣, 麦芽, 杏仁, 薏米","木瓜, 葛根, 茯苓, 荞麦, 燕麦, 绿豆, 黑豆, 黑芝麻, 莲子, 山药, 红枣, 麦芽, 杏仁, 薏米"
"健脾山药,这样选就对了",覃军,,"山药,自古是药食同源的佳品.用对了,单味山药就能养身、治病._xD_
好吃的鲜山药,肥厚多汁,又甜又绵,但有时买回来的,却是又水又脆,令人失望._xD_
山药应当怎么用,怎么买?下面就介绍一些方法,供您参考._xD_
山药千般好,湿盛积滞不宜用_xD_
今之山药,吉称薯蓣.现存最早的中药学著作《神农本草经》把它列为上品,谓:“薯蓣,味甘,寒.主治伤中,补虚赢,除寒热邪气,补中,益气力,长肌肉.久服耳目聪明,轻身,不饥,延年.”_xD_
归纳起来就是说,山药能补虚.它的药性平和,不燥不腻,具有益气养阴、补益脾肺肾、固精止带的功效.常用于治疗脾胃虚弱、肺虚喘咳、肾虚遗精、尿频带下、内热消渴等证.",山药,山药
山药的临床药理作用分析,兰佳怡,"山药,临床药理作用,分析","山药是一种药食同源的佳品,《本草纲目》谓其益肾气,健脾胃,止泄痢,化痰涎,润皮毛.山药可补脾养胃,生津益肺,补肾涩精,对于多种疾病都具有改善作用.目前的临床研究显示,山药对于肾炎、癌症、糖尿病等都具有一定的疗效,鉴于山药的优势,其研究已经受到了学界的关注.本文主要针对山药的临床药理作用进行分析.",山药,山药
云南民族医药治疗肝病组方用药规律研究,"高琪,付婷婷,杨林蓉,王春霞,张超","民族医药,肝病,云南,组方用药规律",目的：对云南少数民族治疗肝病的单验方进行数据挖掘以寻找组方用药规律。方法：将收集并筛选后的处方录入中医传承辅助平台V.软件，运用软件“数据分析”模块中的“方剂分析”功能，进行用药规律挖掘。结果：基于关联规则的单验方组方规律分析结果表明，当定心藤出现时必有十大功劳出现，其支持度和置信度最高；得到治疗肝炎新组方个，彝族、傣族、拉祜族治疗肝病新方各、、个。结论：云南少数民族治疗肝病以单方居多，使用民族药物多为茵陈、青叶胆、十大功劳、土大黄、鱼眼草等清热解毒、利湿退黄之品，使用调味品作为药引，使用动物脏器，注重药食同源、以脏治脏。,"十大功劳, 茵陈, 青叶胆, 土大黄, 鱼眼草","十大功劳, 茵陈, 青叶胆, 土大黄, 鱼眼草"
冬季养生食疗方,钱静庄,,"立冬到立春这三个月中,自然界生机闭藏蛰伏,天寒地冻.冬令时节,为了防御寒气伤身,人体就需要较多的热量以补充冬季过多的消耗,而热量来源于有营养的滋补性食物._xD_
药食同源是中医的传统特色.许多食物既能充饥,又是治病良药,如大枣、山药、芡实、扁豆、龙眼、银耳等.药膳是由食物和药物组合而成.药物有寒、热、温、凉“四性”和辛、酸、甘、苦、咸“五味”,食物也有它的性味.药膳就是家常食品添加某些药物,共同制成菜肴或食品.药膳的优点是既富有营养,又有辅助治疗疾病的作用.以下介绍几款冬季食疗药膳.","大枣, 山药, 芡实, 扁豆, 银耳","大枣, 山药, 芡实, 扁豆, 银耳"
冬天尤需吃海带,韩仪,,"冬季正是进补的好时节,提到进补,很多人就想到冬虫夏草、人参、鹿茸这些名贵药材,觉得进补是件很奢侈的事儿.其实,从中医养生的角度,药食同源,对一般人群来说""药补""不如""食补"".众所周知,海带的营养十分丰富,含有碘、铁、钙、甘露醇、胡萝卜素等人体所需要的成分.","冬虫夏草, 人参, 鹿茸, 海带, 铁","冬虫夏草, 人参, 鹿茸, 海带, 铁"
