篇名,作者,关键词,摘要,没有引进词表的jieba提取的中药材,引进词表的jieba提取的中药材
晋绿号艺机一体化技术示范与推广应用,"刘支平,邢宝龙,杨芳","晋绿号,良繁,艺机一体化,示范推广","山西绿豆常年种植面积余万亩,占全省杂粮作物中杂豆种植面积(约万亩)的％,在我省杂豆生产中占有重要地位,极具开发推广潜力.随着山西农业供给侧结构改革、“农谷”建设及雁门关农牧交错区的大力推进与稳步发展,绿豆作为杂豆中抗旱最强、广适较好、营养最全面、功能最特、在山西各区被广泛种植的小杂粮作物,越来越引起人们的重视.绿豆既是燕山-太行山晋北六县贫困区农民赖以生存的经济作物,也是处于营养平衡膳食宝塔最低层的“三源、三养、三效”作物.绿豆全身都是宝,其籽粒药食同源、秸杆轮饲两用,根系固氮活土,幼苗培肥增绿.在山西晋北独特的地理、生态与旱作栽培条件下,大力发展山西晋北旱作绿豆的有机、艺机、功能化研发与集成示范,带动山西省绿豆的产业化、规模化发展,使山西晋北成为全国有机、特色、功能化绿豆的最重要原料出口供应地,对山西杂粮提质增效最具广阔的经济、社会和生态效益.",绿豆,绿豆
黄精茎点霉叶斑病菌的分离与鉴定,"邹娟,姚传威,邓波侠,李胜华,周准","黄精,草茎点霉,病原菌,ITS","黄精是重要的药食同源植物.从湖南洪江市采集的黄精叶斑病病叶上分离到一株真菌,经接种鉴定为黄精叶斑病的病原菌.从病原菌的培养性状和形态学特征、内转录区(ITS)和系统发育关系比较等方面进行了分析,结果表明:黄精叶斑病病原菌为草茎点霉(Phomaherbarum).",黄精,黄精
薏仁碎米酱油制曲工艺的优化,"张丽,卢红梅,陈莉,常冬妹","薏仁碎米,酱油,制曲,蛋白酶酶活力","随着人们对营养与健康的重视,薏仁米作为药食同源的优质禾谷类食品,越来越受到人们的追捧.而薏仁米在加工过程中会产生大量的薏仁碎米,薏仁碎米具有与薏仁米接近的营养价值,不充分利用将造成薏仁米资源的浪费.酱油制曲中以薏仁碎米为淀粉质原料,对豆粕与薏仁碎米添加比例、米曲霉接种量、制曲温度、制曲时间等进行薏仁碎米酱油制曲工艺的优化.在单因素试验的基础上,通过响应面分析法,以蛋白酶酶活力为判定指标,最终确定的最佳制曲工艺条件为豆粕与薏仁碎米比例:、米曲霉接种量.％、制曲时间.h、制曲温度.℃,蛋白酶活可达到.U/g,略低于常用的豆粕麸皮酱油曲(优化后蛋白酶活达.U/g),说明将薏仁碎米用于酱油酿造是可行的.",麸皮,麸皮
逆流色谱在人参属植物成分分离中的研究进展,"朱晓萌,孔蒙,刘代成,宋祥云,朱姮,王岱杰","逆流色谱,人参属植物,保健食品,研究进展","逆流色谱(CCC)技术在世纪年代由Ito博士创立,近年来,已逐渐成为化合物分离和制备的常用手段,特别是在天然产物研究领域应用日益广泛.人参属植物是名贵的药用植物,富含皂苷等活性成分,不仅是重要的中药资源,目前也越来越多地作为新资源食品或药食同源植物用于食品及保健品的生产,其中活性成分的分离是进一步深入研究及开发应用的基础.文章对逆流色谱技术在人参属植物活性成分分离的成果与进展进行了综述和总结.",人参,人参
山楂药材质量标准研究进展,"石晓晨,张玉,马云,席晓志,张永清,李佳","山楂,标准沿革,规格等级,影响因素,鉴别,含量测定","山楂作为一种药食同源的药材,临床上有非常广泛的应用,其质量的优劣直接影响临床治疗的效果,该文对山楂药材从质量标准沿革、影响因素及鉴别与含量测定的研究三方面作一综述,指出存在的问题,以期为山楂质量标准的完善和规范提供依据.",山楂,山楂
舌尖上的杂交构树,胡艳敏,,"中国美食文化博大精深,构树入食入药已有几千年的历史,三国时期就有食用构树嫩叶的记载.构树食品不仅美味,更是具有医疗保健的功效.《本草蒙筌》记载构树有养生美容、延缓衰老的功效,是不可多得的天然保健品,与中医药学药食同源的基础理论以及现代人体营养学不谋而合.",构树,构树
公丁香生物活性的研究进展,"栾剑,孙贺,范影影,程云清","公丁香,丁香酚,生物活性","桃金娘科植物丁香(Syzygiumaromaticum)是名贵的香料和常见的中药材,在我国具有悠久的栽培和使用的历史,具有广泛的生物活性和良好的应用前景,在卫生部公布的种药食同源原料中位列第一.公丁香主要的功效成分为丁香酚(Eugenol),因其药理作用极其广泛,在药物和农业等领域都有较为广泛的应用.此外,公丁香提取物作为纯天然无毒性且功能稳定的天然产物,具有优良的抗氧化、抗菌等生物学特性,是开发利用新型的天然食品抗氧化剂、防腐剂等的理想材料.因此,研究公丁香的生物活性,为更进一步的开发公丁香的应用价值以及扩大其应用领域方面提供了极有价值的参考.","桃金娘, 丁香, 公丁香","桃金娘, 丁香, 公丁香"
冀北山区北苍术栽培技术研究,谭文文,"北苍术,栽培技术,田间管理,采收加工","近年来随着人们生活水平的提高,北苍术作为一种药食同源的本草药品,得到人们的广泛关注.目前,冀北山区北苍术野生资源越来越少,人工栽培面积虽然因市场需求而不断扩大,但仍然有许多种植户因栽培技术不到位,管理宽泛,而导致产量较低,收入较少.根据冀北山区的气候特点和北苍术的生长习性,总结了北苍术绿色栽培技术,主要从土地选择、整理和施肥、育苗、田间管理、病虫害防治、采收等方面进行详解,以期为本地区的北苍术药材生产提提供技术指导.",苍术,苍术
百合磷茎中RegalosideA、AcetylregalosideC与RegalosideB高速逆流色谱分离及生物活性研究,"陆英,刘仲华,肖文军,傅冬和,谢红旗,曾建国","分离,中药百合,酚酸甘油酯苷,高速逆流色谱(HSCCC),生物活性","建立了高速逆流色谱分离制备药食同源植物百合磷茎中个酚酸甘油酯苷的方法,同时测定了化合物对,-二苯基--三硝基苯肼(DPPH)自由基的清除作用、脂质的过氧化抑制作用及对α-淀粉酶活性的促进作用.以乙酸乙酯-正丁醇-水(.％乙酸,∶.∶,体积比)为溶剂系统,上相为固定相,下相为流动相,从mg百合磷茎提取物中分离得到.mg纯度为.％的化合物,.mg纯度为.％的化合物,.mg纯度为.％的化合物.经质谱及核磁共振鉴定化合物～分别为王百合苷A(RegalosideA)、乙酰化王百合苷C(AcetylregalosideC)、王百合苷B(RegalosideB);活性研究表明,AcetylregalosideC对DPPH自由基清除作用及脂质过氧化抑制作用均最强,RegalosideA与RegalosideB对DPPH自由基清除作用很弱,对脂质过氧化有一定的抑制作用且相近,化合物抗氧化作用强弱为:化合物＞≈.化合物在不同浓度下对α-淀粉酶活性的促进作用具有一定差异,但化合物间无显著差异.",百合,百合
无花果的保鲜技术研究进展,"任小娜,王晓菡,夏娜,曾俊","无花果,物理保鲜,化学保鲜,生物保鲜,营养价值","无花果是一种药食同源的天然食品,具有很高的营养与药用价值,但采摘后易腐烂且难储存.详细介绍无花果保鲜技术的研究现状,为后续的研究提供参考,并对无花果保鲜技术的发展进行展望.",无花果,无花果
柴达木构杞促进运动员低氧适应能力的研究,樊蓉芸,"柴达木枸杞,高原训练,低氧适应","青藏高原特有植物抗缺氧、抗氧化、抗疲劳的功效日益得到重视和应用.本研究将药食同源的青海柴达木枸杞应用于竞技体育高原训练实践中,结果表明世居平原运动员在青海高原训练期间出现AMS分值增加、SpO和肺活量下降、反应时延长、体内脂肪量和体脂率下降等对高原环境与运动重叠缺氧的不适现象,而服用柴迭木枸杞有助于减缓AMS发生率和症状、增加能量储备、增长SpO和肺活量、缩短反应时,有助于提升平原运动员对高原低氧和高原训练的适应能力.",枸杞,枸杞
云南小粒黑壳薏苡产业发展潜力巨大,任贵兴,,"薏苡是一种药食同源的禾本科作物,是中国传统的药食两用食品,其营养价值高,是一种高蛋白质、中脂肪及中糖食品,且多数氨基酸、不饱和脂肪酸含量要比其他粮食作物高.研究表明,薏苡仁具有健脾利湿、除疲止泻、清热解毒散结、排脓等药理作用.薏苡仁酯、薏苡仁油等有着很强的抗肿瘤作用,薏苡仁中还含有丰富的多糖,具有显著的降糖作用.",薏苡仁,薏苡仁
基于测序技术的红花基因组学研究进展,"孙嘉磊,覃瑞,邢永忠,陈雁","测序技术,红花,基因组学","红花(CarthamustinctoriusL.)是药食同源的经济作物,富含丰富的营养物质与药用活性成分,可用于活血通经,去瘀止痛等.对经闭,难产,产后瘀血作痛,痈肿,跌打损伤有一定的治疗效果.随着人们对红花经济价值的重视,红花的应用愈发广泛,与日常生活联系日益密切.如今,迫切需要破解红花全基因组,为红花种质资源筛选、优良性状选育等提供理论依据.基因测序技术是研究红花基因组学的重要手段,在红花种质资源评价、遗传多样性分析、目标基因筛选、基因定位和分离等方面发挥重要作用.本研究综述了红花测序技术研究进展情况,着重介绍了三代测序技术,同时阐述了组装技术的研究进展,以及分子标记在红花基因组学的应用.这些可为红花遗传连锁图谱构建、关键基因定位、物种起源机制、分子标记辅助育种(MMAB)等提供参考.",红花,红花
蔬菜皂苷的生物活性与应用研究进展,"金晶,张永吉,张永泰","蔬菜,皂苷,生物活性,应用","皂苷是一类糖苷,它的苷元一般为三萜或是甾体,广泛存在于高等植物中.植物中发现及应用皂苷最多的是人参,而且很多中药中的皂苷成分及功效也已经得到了系统的研究.作为重要的次级代谢产物,蔬菜中皂苷的分离提纯及应用也经常被报道;而现在人们都注重饮食健康,挖掘药食同源的蔬菜新品种、新功效也是重要的研究方向.本文对蔬菜中的皂苷的提取纯化工艺及其生物活性进行总结,以期为蔬菜皂苷的应用提供参考.",人参,人参
秦巴山地野生凹叶景天在关中平原的扦插繁殖试验,"王军利,冯婧芝,卜颖华,汤文华,董立宝,豆秀英","凹叶景天,引种试验,扦插繁殖,叶片扦插,蘑菇栽培废料","凹叶景天(SedumemarginatumMigo)是一种优质的药、食同源植物,也是待开发的优质园林绿化植物.近年来,各地的科研人员对其药用成分、营养成分及药食应用等进行了深入研究,但针对其引种、栽培及繁殖的研究成果不多.目的:探索野生凹叶景天的引种与扦插繁殖.材料:秦巴山地野生凹叶景天的枝条及叶片.方法:在关中平原地区对其进行春、夏、秋季扦插繁殖试验.试验设定的变量有季节(光照强度和温度)、扦插基质组成、基质湿度等.结果:野生凹叶景天可用枝条及叶片扦插法进行繁殖,季节、扦插基质的组成及基质湿度,对其繁殖系数及新芽萌发量影响较大.结论:凹叶景天可以在生长季节采用枝条及叶片扦插法进行繁殖,混合基质有利于提高扦插成活率;基质稍偏干有利于提高扦插成活率;基质过湿会降低成活率;光照强度及温度与成活率成正相关.",景天,景天
海南不同产地草豆蔻的差异蛋白分析,"吴秀丽,王旭初,段红叶,李建玲,何文英","海南草豆蔻,蛋白图谱,差异蛋白","草豆蔻为典型的药食同源植物,关于其主要的化学成分已早有研究,但对其含有的植物蛋白却鲜有研究.本研究首次探索了海南地道草豆蔻(白沙和霸王岭个产地)中所含蛋白信息.应用双向电泳进行蛋白分离得到相应全蛋白图谱,并用ImageMaster.软件比较筛选出不同产地的高丰度差异蛋白,通过基质辅助激光解析-电离飞行时间质谱分析(MatrixAssistedLaserDesorption/IonizationTime-of-FlightMassSpectrum,MALDI-TOFMS)及MascotDistiller软件对蛋白进行搜库.结果显示:个不同产地草豆蔻共有个高丰度差异蛋白.去除相同的蛋白,经分析确定这些差异蛋白归属种植物蛋白,主要涉及植物的抗菌活性、应激反应、细胞分裂增殖及对植物物理性状的影响等方面.首次发现某些差异蛋白可能具有一定的抗菌活性,如、及号的类似豌豆的抗菌肽段,或号的纤维状细胞分裂蛋白,号的泛素蛋白连接酶E,号的小分子热休克蛋白,及号的谷胱甘肽s-转移酶.这些差异蛋白均与草豆蔻极其主要的活性组份所具有的抗炎抑菌、毒性低等的特点相关.本研究结果不仅是对草豆蔻所含物质中的生物大分子种类的补充和完善,同时也体现了不同产地草豆蔻的生物多样性特点,为深入利用、研究这种药食同源的植物及全面了解其药理活性提供了一定的科学依据.","草豆蔻, 豌豆","草豆蔻, 豌豆"
三种具有降压作用的药食两用物品研究进展,"贺韵涵,辛宝","药食两用,中药,高血压","将临床有降压效果的单味中药与年我国卫生部公布的《既是食品又是药品的物品名单》结合,筛选出种具有降血压作用的常用药食同源中药:夏枯草、决明子、葛根、山楂、菊花,分别概括这味中药现代药理研究、降压机制及临床疗效,综述药食两用药品在治疗高血压方面有显著的效果.","夏枯草, 决明子, 葛根, 山楂, 菊花","夏枯草, 决明子, 葛根, 山楂, 菊花"
药食用真菌菌丝提取物的降糖和降脂活性,"杜妍,韩一凤,陆震鸣,徐国华,许正宏,耿燕","药食用真菌,胰岛素抵抗,葡萄糖耐受,脂肪肝","药食用真菌是世界公认的具有良好疗效的药食同源物质.然而,其中主要生物活性的成分尚未研究透彻.在本研究中,我们研究了虫草头孢Cephalosporiumsinensis、蝙蝠蛾被孢霉Mortierellahepiali、猴头菌Hericiumerinaceus、灵芝Ganodermalingzhi、蜜环菌Armillariamellea、牛樟芝Antrodiacinnamomea等种菌丝体的正己烷、氯仿、乙酸乙酯和甲醇提取物的降糖降脂活性.我们通过人类肝癌细胞株HepG-建立了胰岛素诱导的胰岛素抵抗模型和油酸(OA)诱导的甘油三酯(TGs)沉积模型,并对种提取物的降糖降脂活性进行了功能评价.结果表明在无细胞毒性的作用浓度下＜μg/mL),猴头菌和灵芝的正己烷、氯仿、乙酸乙酯、甲醇提取物以及虫草头孢的正己烷提取物剂量依赖性的增加HepG-细胞葡萄糖的消耗;虫草头孢的正己烷、乙酸乙酯、甲醇提取物以及灵芝的正己烷、乙酸乙酯提取物和蝙蝠蛾被孢霉的正己烷提取物剂量依赖性的抑制OA诱导的TGs合成.这些结果表明,药食用真菌可以被用来调控糖脂代谢紊乱.","蝙蝠, 猴头菌, 灵芝, 蜜环菌","蝙蝠, 猴头菌, 灵芝, 蜜环菌"
海南种植葛根的发展前景,"黄雅琪,向银林","葛根,海南,生长表现,发展前景,建议","葛根是我国分布广泛、人工种植较多的一种药食同源的植物,此前海南还没有规模化商品种植.本文对葛根在海南儋州等地的生长表现,以及在海南种植的主要优势作了阐述,分析了葛根在海南种植的发展前景,并提出发展建议.",葛根,葛根
苦苣菜水培生产技术,"康忠华,王康",,"苦苣菜是一种药食同源的植物,在我国西北、华北、东北、华中地区都有栽培.苦苣菜生长旺盛,适应性强,在田间、路旁均可生长.但苦苣菜在自然条件下具有较强的生长季节性,因而不利于它的开发和利用.如采用温室静止水培法进行栽培,就可实现苦苣菜的周年供应.",苦苣,苦苣
巧食薏仁治小病,陈其华,,"薏仁是常见的药食同源食物,有多种保健治病的功效,一般人群均可食用,尤其适宜多湿地区及关节炎、肢体浮肿、脚气病、肥胖等人群.推荐薏仁的个小验方,帮您祛病健体._xD_
病后调理——薏仁红枣小米粥_xD_
验方:取薏仁、红枣、小米各克,加水煮成粥,空腹食用,每日次._xD_
病后术后,人体较为虚弱,应该调养身体、适当滋补.俗话说""药补不如食补"",食物中的营养素更容易被人体消化吸收,应先以流质或半流质的食物来调理脾胃,再逐渐增加营养,恢复元气.方中,薏仁性味甘淡,微寒,归脾、肺、胃经,可用于久病后体质虚弱的调理.现代研究表明,薏仁具有抗炎镇痛、提高免疫力、调节血脂代谢等多方面的药理作用,能促进身体愈合.红枣性平,味甘,归脾、胃经,有补中益气、健脾养血等功效,可用于脾胃虚弱、气血不足所致的气短懒言、面色萎黄、不欲饮食等症状,特别是病后期和手术后调理.现代药理研究也表明,红枣具有增强抵抗力、增加红细胞、助消化等作用.小米能健脾、养胃、补虚,易消化,适宜久病体虚的调理.",红枣,红枣
特色美食蔬菜养生——论桂林柳叶菜花长短,李河山,"桂林,特色时蔬,柳叶菜花,美食养生","蔬菜养生早在《神农本草经》《本草纲目》等书籍就有蔬菜养生价值、食疗食补详细论述,在中国有千年风俗基础和食药同源传统。谈起桂林柳叶菜花人人点赞,柳叶菜花是桂林特有蔬菜盛产之一,据记载,栽培至今已有多年的历史,在清朝嘉庆元年间柳叶菜花栽培十分广泛,其因叶形似柳叶而得名,由于桂林纬度相对高,秋冬便霜季,柳叶菜花无苦味而特别鲜甜脆嫩,且美味又营养;柳叶菜花长短存在利弊形因解析,并采用科学烹饪举措,翠绿地柳叶菜花在桂林餐桌即成一道亮丽的时蔬特色美食,独特体验式饮食供大家对蔬菜康养另一种新概念。","柳叶菜花, 柳叶","柳叶菜花, 柳叶"
响应精准扶贫号召成就公益扶贫事业——访山西曦晨源科贸有限公司,马开,,"沙棘是一种落叶性灌木,其特性是耐旱、抗风沙,可以在盐碱化土地上生存,因此被广泛用于水土保持.沙棘除了作为一种美味营养的水果外,还拥有极高的药用价值,属于药食同源的珍品.在其诸多的别称雅号里便可窥一斑知全豹.沙棘被日本人民称为""长寿果""、俄罗斯人民称为""第二人参""、美国人民称为""生命能源""、印度人民称为""神果""、中国人民称为""圣果""、""维C之王"".今天我们的故事就从这里讲起……","沙棘, 人参","沙棘, 人参"
企业如何把握好新风口机遇,吴连忠,,"由于国家对大健康产业的重视,健康酒在近几年受到了众多厂商的追捧,让长期在白酒行业厮杀的厂商们似乎看到了一片蓝海,于是一些知名白酒企业也加入了健康酒行业,一些知名药企也开始研发生产配制酒、食补酒;健康酒虽然算不上新名词,但新健康酒包含的小品类更广泛,不但包含传统保健酒、药酒,也包含药食同源药材的配制酒、养生酒及采用酿酒新工艺生产的健康白酒等,健康酒迎来了新风口.",酒,酒
苦苣菜静止水培生产技术,"康忠华,王康",,"苦苣菜属一二年生草本植物,是一种药食同源的植物.我国苦苣菜资源丰富,在西北、华北、东北、华中地区都有分布.苦苣菜的生长能力旺盛,其适应性力很强,在田间、路旁均能够生长.但是因其具有严重的季节性,不利于其开发和利用.若采用温室静止水培法进行人工栽培,将实现周年供应,产量均可达kg/hm以上.",苦苣,苦苣
广东肾病高发与中药煲汤有关吗,"张苗,徐尤佳,王婷",,"《舌尖上的中国》第三季的开播,成为这个春节假期吃货们最开心的事情之一.年月日播出的第四集讲述《食疗并用的中华药膳》,阐述饮食的""养""人之道,探讨药食同源、食物与养生之间的关系._xD_
草药炖鸭、枣泥山药膏、当归生姜羊肉汤……节目的大半篇幅展示广东人在煲汤时讲究的药膳.","鸭, 当归, 生姜","鸭, 当归, 生姜"
刘持年运用玫瑰花治疗心系疾病验案举隅,"袁琛皓,郭炜","玫瑰花,刘持年,验案","玫瑰花是一味药食同源的植物,被广泛应用于医疗、保健、美容等领域.刘持年教授用药选方独具匠心,常用经典方剂配伍玫瑰花来治疗心系疾病,疗效显著,现介绍刘老师运用玫瑰花治疗睡眠功能障碍、心房纤颤、冠心病验案三则.",玫瑰花,玫瑰花
天然药食两用资源桑葚利用研究,"李惠民,谷瑞民,柳荣军,李洁","桑椹,营养成分,药用,食用","桑葚在我国藴藏量大,营养成分丰富,是卫生部认定的药食同源产品。主要介绍了桑椹的营养成分,药用价值,以及桑椹食品开发。",桑椹,桑椹
长江流域塑料大棚菊花脑栽培技术,汪李平,,"菊花脑,又名菊花菜、菊花叶、黄菊仔、路边黄等,是菊科菊属以宿根越冬的多年生草本植物,幼嫩茎叶可作蔬菜食用,炒食、凉拌或煮汤均可,由于其具有浓郁的菊花香味,食之清爽可口,能增进食欲,同时还具有消暑解渴、润喉化痰、清热凉血、调中开胃、降低血压等作用,是较好的药食同源两用植物.","菊花脑, 菊花, 菊花叶","菊花脑, 菊花, 菊花叶"
市面上卖的山楂片有消食作用吗?,陈洪燕,,"问:市售山楂片可以消食吗?与中药山楂是不是一回事?_xD_
答:山楂是一种药食同源的中药,市面上卖的山楂片属于食品,是以山楂为主要原料,加入糖等食品添加剂制作而成的,它有一定的开胃、消食的作用,但不以药用为目的.这些含糖量高的山楂片,过多食用,反而还会影响食欲.",山楂,山楂
甘肃靖远县枸杞产品开发现状及建议,"王文君,王丽君","靖远县,枸杞,产品开发,建议","枸杞是我国传统的药食同源食品之一.枸杞子原产于中国甘肃省靖远县,于世纪年代在五合乡为中心的北八乡开始大面积种植,现有种植面积约.万hm.本文以靖远县为例,在分析枸杞产品开发现状的基础上,提出了推行科学标准的种植模式,强化科技培训,提倡创新农业,重视品牌建设,加强宣传力度等建议.","枸杞, 枸杞子","枸杞, 枸杞子"
养生不需重金——大枣、蜂蜜,周畅玓,,"随着生活水平的不断提高,人们对保健、养生的重视程度亦越来越强.人参、西洋参、冬虫夏草、鹿茸、阿胶、三七等各种名贵中药材都成为馈赠亲友或自用保健的上佳选择.但是这些名贵的中药材大多""身价不菲"".面对这些中药材高昂的价格,很多朋友只能望而却步.对于没有较高保健预算的朋友来说.选择一些药食同源的中药材进行日常的养生保健.不失为一个好选择.在这里,为读者朋友们介绍大枣和蜂蜜,二者均为具有补益功效的药食同源中药材._xD_
大枣的功用_xD_
大枣,始载于《神农本草经》,被列为上品.其言""大枣主治心腹邪气,安中,养脾气,平胃气,通九窍,助十二经,补少气、少津液、身中不足,大惊,四肢重,和百药.""大枣性温,味甘,归脾、胃、心经;其药性平和,入脾胃而善补中益气,为调补脾胃的常用辅助药;能养血安神,用于妇女情志抑郁,心神不安;与药性峻烈或有毒之品同用时则能缓和药性.大枣、生姜与解表药同用时能调和营卫,它们与补益药同用时则能提高滋补效力,增助药性.对于脾胃虚弱、气虚不足、倦怠乏力、食少便溏的人来说,单独食用大枣亦可见效.大枣食用方便,既可直接食用,还能煮水、熬粥,如《补品补药与补益良方》中用大枣、小米或糯米、食糖熬制而成的大枣粥等等.","人参, 西洋参, 冬虫夏草, 鹿茸, 阿胶, 大枣, 蜂蜜, 生姜, 糯米","人参, 西洋参, 冬虫夏草, 鹿茸, 阿胶, 大枣, 蜂蜜, 生姜, 糯米"
芦笋,赵元,,"新鲜脆嫩,是一年中最好吃的时候,而且芦笋也可以算是破土而出的鲜嫩,直接从地里摘上来的芦笋,农药打得很少,保证安全.芦笋属于药食同源,富含氨基酸和多种微量元素,低脂低蛋白,高纤维高维生素,好处非常多.",芦笋,芦笋
山西曦晟源:利用优势资源做强沙棘生态扶贫,"李安平,张文丹",,"沙棘,享有“世界植物之奇”、“维生素宝库”之称,其根、叶、花、果均可入药,特别是果实中含有人体不能合成的利于健康的多种维生素,是药食同源植物.同时,沙棘因为根系发达,萌蘖力强,根有根瘤菌,能固氮肥土,可在防风固沙、减少水土流失、净化空气、减灾增收等方面发挥重要作用.可以说,沙棘是把经济效益、生态效益和社会效益集于一身的作物.",沙棘,沙棘
