篇名,作者,关键词,摘要,没有引进词表的jieba提取的中药材,引进词表的jieba提取的中药材
决明子茶和运动双重干预对老年女性的减肥效果,赖学鸿,"药食同源,决明子茶,太极柔力球,老年人,身体形态,血脂代谢","目的探讨饮用决明子茶结合运动的双重干预对单纯性超重或肥胖老年女性身体形态与血脂代谢的影响.方法在知情、自愿的基础上招募某市老年活动中心~岁的老年女性并经病史询问和常规体检确定适宜本研究的名单纯性超重或肥胖老年女性为研究对象,随机分成实验组和对照组(实验组名,对照组名),实验组每人每天饮用一份决明子茶并练习式太极柔力球min,对照组仅每天与实验组同时同地进行太极柔力球练习.结果饮用决明子茶结合运动的双重干预可明显降低老年女性的心率(P＜.),改善血压水平(P＜.),提升心肺功能(P＜.),对老年女性的BMI、腰围、WHR、腹皮褶和腰皮褶的良性改善显著(P＜.),可显著降低老年女性血清TC、LDL、ApoB含量(P＜.),升高HDL、ApoA水平(P＜.).结论饮用决明子茶结合运动的双重干预对老年女性身体形态与血脂代谢指标的影响优于仅采用运动干预的对照组,加之配方简单、价格低、药源广,又是简便易行的代茶饮,是老年女性控制体重、抑制和预防肥胖的一个不错的选择.",决明子,决明子
四种植物的乙醇提取液对鸡蛋保鲜效果的比较研究,"王婵,马敬中,袁超","鸡蛋,金银花,药食同源物品,乙醇提取物","研究对鸡蛋保鲜有效的中草药提取液.采用银杏叶、金银花、蒲公英和肉桂皮种植物的乙醇提取液作为保鲜剂,对鸡蛋进行涂膜保鲜实验.在温度℃、相对湿度%～%的贮藏条件下,对鸡蛋各项感官指标和理化指标进行测定,结果显示各处理组均具有一定的保鲜效果.其中以金银花提取液的效果最佳,贮藏d后好蛋率为%,其失重率为.%,蛋黄指数为.,浓蛋白含量为.%,哈夫单位(HU)为.,气室高度为.mm.","银杏叶, 金银花, 蒲公英, 肉桂","银杏叶, 金银花, 蒲公英, 肉桂"
罗汉果植物保健饮料的研制,"李良,吕国红,钟晓凌,张江","罗汉果,植物饮料,药食同源,稳定性",以罗汉果为主要原料研制罗汉果植物保健饮料.通过正交试验和感官评价的方法确定该饮料的最佳配方为:罗汉果提取物.g/L、枸杞提取物.g/L、决明子提取物.g/L、杭白菊提取物g/L、白砂糖g/L.以离心沉淀率为指标证实添加.%的果胶该饮料的稳定性最佳.分光光度法检测该饮料中有效罗汉果苷的含量为.mg/L.该罗汉果植物保健饮料的感官指标、理化指标和微生物指标均符合国家标准.,"罗汉果, 枸杞, 决明子, 白砂糖","罗汉果, 枸杞, 决明子, 白砂糖"
贵州省刺梨产业现状梳理及思考,"查钦,张翔宇,阮陪均,马梦强,樊旭,邹涛,柳敏,成忠均","刺梨,保健食品,产业现状,贵州省","刺梨是贵州省独具特色的药食同源类植物,刺梨产业是贵州省大健康产业的一部分,在精准扶贫、乡村振兴和经济发展过程中发挥着重要作用.本研究通过对贵州省刺梨产业政策整理和分析、对刺梨产业现状进行梳理,总结出果品和食品是刺梨未来发展的重点方向,保健食品是刺梨产业发展的必由之路,技术是刺梨产业发展的核心要素,以期为刺梨产品研究及产业发展提供借鉴.",刺梨,刺梨
枸杞多糖对特殊环境致应激损伤防治的研究进展,"高洁,李森,王海燕,龙在云,刘媛,王永堂,严军,余静,伍亚民,杨策","枸杞属,氧化性应激,特殊环境,创伤和损伤","枸杞多糖是从茄科枸杞属植物果实中提取的多糖类化合物,是枸杞中的主要有效成分之一,具有增强免疫、抗氧化、抗衰老、抗肿瘤、保护视网膜、保护肝脏、保护神经系统、降血糖、降血脂等多种药理作用.目前,枸杞多糖由于其药食同源特性,在应激损伤中的保护应用受到越来越多的关注.笔者结合枸杞多糖国内外最新研究,对近年来枸杞多糖抗应激作用及其机制进行系统分析,以期为枸杞多糖在特殊环境下拮抗应激研究与应用推广提供新的思路和依据.",枸杞,枸杞
灵芝的药理作用和临床应用研究进展,"谢怡琼,王琪瑞,孙思雅,来梦茹,程汝滨,邱晓华","灵芝,药理作用,临床应用,研究进展","灵芝作为最新纳入""药食同源""目录的名贵中药材之一,其药用历史悠久,药用价值高,化学成分多样,富含多种有益于人体健康的成分,具有广泛的药理作用,其主要药用部位有灵芝孢子粉、子实体、菌丝等.灵芝多糖、灵芝三萜、灵芝酸等成分被认为是灵芝发挥其不同药理作用的主要活性成分.现代药理学研究发现,其具有防治心血管疾病、保肝护肝、抗肿瘤、免疫调节、抗衰老、抗菌等作用,在辅助治疗肿瘤等方面疗效确切,应用广泛.目前对于灵芝的基础研究及临床前试验较为普遍,而临床应用研究亟待加强.本文对近年来灵芝药理作用的研究进展进行总结,梳理了其临床应用的现状,并对存在的问题进行了分析,对后续的开发和利用进行了展望,以期为灵芝相关健康产品的开发提供参考和借鉴.",灵芝,灵芝
山楂膳食纤维的研究进展,"刘田,崔同,高哲,田粟","山楂,膳食纤维,健康功效,提取,含量分析","山楂(CrataeguspinnatifidaBge)是我国资源丰富的药食同源的植物.现代研究表明,山楂果肉中富含维生素、矿物质、膳食纤维以及黄酮类、三萜类等多种植物化学成分,具有抗氧化、抗肿瘤、抗菌、抗病毒等作用.该文主要综述近年来山楂膳食纤维的研究进展,内容涉及山楂膳食纤维降血脂、润肠通便、改善肠道菌群、抗氧化清除自由基、抗菌等健康功效,以及含量分析、提取方法等方面,旨在为山楂膳食纤维的进一步研究、开发和利用提供参考.",山楂,山楂
栀子中的营养活性物质及其组方在猪生产中的应用示例分析,"张震宇,张吉鹍","栀子,营养活性物质,替抗,内毒素,组学产品","文章就药食同源中草药栀子的营养活性物质及其抗菌、抗内毒素引起的炎症反应等生物活性进行了综述.并对以这些生物活性为基础的栀子示例组方及其组合效应进行了分析,旨在为新的替抗栀子饲料组学产品的研制提供新的思路.",栀子,栀子
桑叶黄酮降糖、降脂作用与机制及其在动物生产中的应用,"冯淦熠,刘莹莹,李颖慧,周玲","桑叶黄酮,提取方法,降糖,降脂,动物生产","桑叶作为一类广泛分布于我国南北各地的药食同源植物资源,含有黄酮、生物碱、氨基酸、多糖和甾类等天然活性成分,具有降血糖、降血脂、抗病毒、抑制肿瘤等多种生理功效.桑叶中黄酮类物质含量丰富,因而对其生物学活性的研究正日益成为学者们关注的热点之一.本文从桑叶黄酮的提取方法入手,对其降糖、降脂作用与机制及其在动物生产中的应用进行综述,为富含黄酮的桑叶作为一种新型、绿色的饲料添加剂应用于养殖业提供参考依据.",桑叶,桑叶
马齿苋“成分-活性-中药功效-疾病”研究进展及关联分析,"秦月雯,侯金丽,王萍,王岚,殷小杰,张毅,俞励平,许海玉","马齿苋,本草考证,品种鉴定,资源分布,成分-活性-中药功效-疾病","马齿苋是一种药食同源品,具有清热解毒、凉血止血、止痢的功效,为常见中药,作为药物安全性高.马齿苋具有多种活性成分及药理作用,为了充分开发利用马齿苋,加快马齿苋研究的现代化进程,综述马齿苋的研究进展并在此基础上对于其“成分-活性-中药功效-疾病”进行关联分析,为马齿苋的现代化研究提供思路.",马齿苋,马齿苋
利川莼菜休眠芽形态特征及形成原因探究,"覃章辉,皮秀权,陈银花,胡峰,王明红","莼菜,夏季型休眠芽,冬季型休眠芽,春莼,秋莼","莼菜是世界著名珍稀的药食同源水生蔬菜.将莼菜整个生长发育期分为个时期,即萌芽、春莼、夏季休眠、秋莼和冬季休眠时期,重点描述莼菜夏季型和冬季型休眠芽的形态特征及可能形成的原因.调查分析发现,莼菜休眠芽的产生与自然条件(如温度、水深)和人为因素(如采摘程度)有密不可分的联系.","莼菜, 莼","莼菜, 莼"
云南省草果产业发展现状及对策,"杨青,陈达菊,杨羚钰,茹瑞红,陈显梅","草果产业,发展现状,调研,问题,对策,云南省","草果既是一种传统的中药材,又是生活中常见的香辛料,是重要的药食同源植物.通过对云南省主要草果产区的栽培和加工情况进行实地考察调研,概述了云南省草果产业发展现状,探讨了发展中存在的问题,并对云南省草果产业今后发展提出建议,以期为云南省草果产业发展提供借鉴.",草果,草果
马齿苋生物碱的研究进展,"鲍守民,贾红梅,邹忠梅,张宏武,郑宜,热增才旦,于猛","马齿苋,生物碱,药理活性,质量评价,体内代谢","马齿苋是一种药食同源的植物,其主要含有生物碱、黄酮、萜类、多糖等成分,因其生物碱结构类型多样,且具有较好的药理活性,近年来引起了广泛关注.主要针对马齿苋中生物碱类化合物的结构类型、药理活性、质量评价及体内代谢研究进展进行归纳总结,为马齿苋的开发利用及进一步研究提供参考.",马齿苋,马齿苋
新冠肺炎疫情对谷子高粱糜子产业的影响分析,"刘猛,刘斐,张新仕,赵宇,赵文庆,王桂荣,李顺国","新冠肺炎疫情,谷子高粱糜子,生产,消费,流通,产业发展,影响","新冠肺炎疫情暴发以来,全国各行各业均受到不同程度的影响.为了研判疫情对谷子高粱糜子产业的影响,以及开展何种措施应对复工复业,采用网络软件调研与电话、微信访谈等相结合的方式,对谷子高粱糜子生产、加工流通、销售以及小米的消费等环节进行了调研.结果表明疫情的发生:对谷子高粱糜子的种植影响不大;对原粮的销售和价格波动影响较小;对种植户购买农资和农资储备有较大影响;疫情期间存在工人短缺、劳动成本高、运输不畅等现象,造成加工企业不同程度的损失;加快了产品销售由线下向电商、朋友圈等线上销售方式的转变;促进消费者对营养丰富、药食同源食品的需求,增加了居民杂粮多样性的需求.最后,从农资供应、春耕备播,开展线上技术培训,有序恢复生产,特色产业脱贫措施等方面提出了促进产业发展的对策建议.",高粱,高粱
荷叶化学成分及其药理活性研究,"高振华,孙伶俐,王豪,王超然,王联芝","荷叶,化学成分,药理活性,降脂减肥","荷叶是我国著名的传统中药,具有消暑利湿、健脾升阳、减肥降脂等重要价值.荷叶气味清香,功效口感俱佳,自古以来在药品、食品、保健品等方面均有应用,现在也被列为药食同源的药材之一,具有较高的食用和药用价值.现在医学研究表明,荷叶具有减肥降脂、抗氧化、抑菌、止痉等多种功效,随着近年来肥胖患者的不断增多,健康养生的荷叶类产品也随之受到越来越多的关注.本文针对荷叶中化学成分及其药理药效研究进行综述,以此为其进一步的药效基础研究以及新药开发研究提供参考.",荷叶,荷叶
模糊数学感官评价法优化三种干果复合固体饮料的配方,"高涛,陈虹旭,唐华丽","模糊数学法,主成分分析(PCA),复合固体饮料,配方优化,啧雾干燥","以枸杞、山楂、红枣三种药食同源物品为原料,经高压均质、喷雾干燥等工艺制得三种干果复合固体饮料.综合模糊感官评分、可溶性固形物含量、总酸含量、溶解时间、澄清度建立主成分综合评价模型,并以主成分分析综合得分为指标,利用k()正交试验对喷雾干燥法制备三种干果符合固体饮料的配方进行优化.实验结果表明,三种干果复合固体饮料的最优配方是以mL饮用水为标准,枸杞汁添加量％,红枣汁添加量％,山楂汁添加量％,复合稳定剂添加量.％,白砂糖添加量％,柠檬酸.％,麦芽糊精％.在此条件下的产品的主成分综合得分为.,其颜色为橙黄色,色泽透亮,口感细腻,具有枸杞,山楂,红枣的复合香味.","枸杞, 山楂, 红枣, 白砂糖, 麦芽","枸杞, 山楂, 红枣, 白砂糖, 麦芽"
黄河三角洲盐碱地发展芦笋产业的优势与措施,"厉广辉,侯蕾,夏晗,赵传志,赵术珍,范仲学,尹俊玉,王兴军","芦笋,黄河三角洲,盐碱地,农业结构调整","黄河三角洲是我国滨海盐碱地的重要组成部分,传统的种植模式为粮棉二元结构,种植结构单一,经济效益不高.芦笋是一种多年生的食药同源型蔬菜,是出口创汇型农产品,经济效益高,且耐盐碱性强,还可改良土壤、保持水土,是盐碱地改良的先锋作物.在黄河三角洲发展芦笋产业有独特的优势,可带动农民增收,促进乡村振兴,改良生态环境,具有显著的经济、社会和生态效益.本文提出了黄河三角洲芦笋产业生态可持续发展的思路和举措.",芦笋,芦笋
葛根异黄酮的现代研究进展,"刘亚美,陈琼,吴菲菲,李化强","葛根,化学成分,提取方法,药理作用,进展","葛根是豆科类植物野葛的粗根,种类丰富,向来被人们称为""千年人参"",是中国鲜有的药食同源植物.近年来的研究表明,葛根的化学成分有异黄酮类、香豆素类、生物碱类、三萜类、芳香类、淀粉、氨基酸等物质,其有效成分异黄酮有治疗心脑血管疾病、保护肝脏和肾脏、调节雌激素平衡、增强免疫力、改善糖脂代谢等方面的作用.本文通过查阅近年来的相关文献,综述葛根异黄酮的提取方法和药理作用进展,为广泛阅读者能够快速有效的全面认知葛根提供了理论依据.","葛根, 人参","葛根, 人参"
咽痛、咳嗽、目赤肿痛?巧用菊花入药治,"胡世云,沈鸿婷",,"随着天气逐渐炎热,人体容易出现咽痛、咳嗽、痰涕黄等外感热证,并兼有心烦易怒、目赤肿痛等内热证的表现._xD_
下面为你推荐一款药食同源的膳食材料——菊花.学会巧用菊花,可以帮你缓解上述种种不适,省事又省钱._xD_
菊花来源于菊科植物菊的干燥头状花序,主产于安徽、山东、四川、江苏、浙江、河南等省.按产地和加工方法不同,分为“亳菊”“滁菊”“贡菊”“杭菊”四种药用菊花.于秋末冬初花期开始分批采集,除去枝叶和杂质,阴干(亳菊)或焙干(贡菊),或经硫黄熏过(滁菊),或蒸(杭菊)后晒干而成.","菊花, 硫黄","菊花, 硫黄"
指纹图谱技术在黄精质量控制研究中的应用分析,"罗莎,鲍康德,姜程曦","黄精,指纹图谱,质量控制,应用","黄精是我国传统的中草药,属于药食同源性药材.黄精含有多糖、甾体皂苷、蒽醌、生物碱等化学成分,具有降血糖、降血脂、抗炎、抗肿瘤、调节免疫等作用,现代临床常用于治疗糖尿病、动脉硬化等疾病.通过对指纹图谱技术在黄精质量控制中的应用研究进行论述,为黄精的鉴定及保证黄精的质量控制奠定基础.",黄精,黄精
大麦籽粒功能成分的主多基因遗传分析,"杨涛,杨加珍,罗红梅,杜娟,普晓英,杨晓梦,李霞,曾亚文","大麦(HordeumvulgareL.),生物碱,抗性淀粉,主多基因","大麦是药食同源作物,含生物碱、抗性淀粉等成分.为研究大麦籽粒中生物碱、抗性淀粉含量的主多基因的作用,本研究以'云啤号'和大粒麦及其作为亲本所构建的重组自交系群体为研究材料,利用植物数量性状主基因+多基因遗传模型分析方法对大麦籽粒生物碱、抗性淀粉含量的主多基因进行遗传分析.结果表明,生物碱和抗性淀粉含量选用的最佳模型是均为E--,即两对连锁主基因+多基因互补作用模型.大麦RIL群体籽粒两年生物碱的遗传力分别为.％和.％,大麦RIL群体籽粒两年抗性淀粉的遗传力分别为.％和.％,大麦籽粒功能成分含量的遗传力大小为抗性淀粉＞生物碱.通过研究生物碱和抗性淀粉的遗传机理有助于更好地挖掘其药用价值,有利于提高功能成分育种及其在生产上的效率.",大麦,大麦
火龙果五叶草莓复合果酱加工工艺研究,"孙娜,朱秀娟,王华,胡文斌,王都留","低糖,红心火龙果,野生五叶草莓,复合果酱,加工工艺","以红心火龙果、野生五叶草莓两种药食同源水果为原料,确定了火龙果五叶草莓复合低糖果酱的最佳配方.通过单因素试验和Box-Benhnken中心组合设计试验,结果表明:低糖火龙果五叶草莓复合果酱的最佳配方为火龙果和五叶草莓质量比.∶、木糖醇添加量.％、柠檬酸添加量.％、果胶添加量.％,在此优化条件下,所得酱体呈紫红色,有光泽,甜酸适口,组织状态、涂抹性能良好,产品质量符合国家标准.",草莓,草莓
葛根高粱复合酿造山西老陈醋的工艺优化,"赵红年,赵芳,林汲,梁丽娟","葛根,山西老陈醋,工艺优化,正交试验","葛根是药食同源植物,营养丰富且具有一定的保健作用.为了促进葛根的深加工,提高山西老陈醋的保健功能,以葛根、高粱为原料,采用传统工艺酿造山西老陈醋.通过单因素和正交试验探究葛根与高粱比例、葛根粉碎粒度、复合原料蒸煮时间、酒精发酵时间、熏醅时间等因素对山西老陈醋中葛根素含量的影响,确定最佳工艺.结果表明:葛根占高粱重量比为％,葛根粉碎粒度为目,复合原料蒸煮时间为min,酒精发酵时间为d,熏醅时间为d,所制得的山西老陈醋葛根素含量达.mg/dL.该工艺酿造的山西老陈醋不仅保留了其风味特征,还增加了功能成分葛根素的含量,显著提高了山西老陈醋的保健功效.","葛根, 高粱","葛根, 高粱"
燕窝功效考,"樊耀华,范群艳,李宗晖,刘堃锋,连建梅,王雅馨,赖小平,李耿","燕窝,功效,考证","燕窝已传入中国千年余,人们对其认识逐渐从一种食物成为一种药食同源的珍品.燕窝的药用认识在元朝已形成雏形,明朝燕窝的功效被逐步发现.在清朝,燕窝被广泛运用于疾病的治疗.然而,中医对于燕窝的药用价值尚未形成统一的认识,限制了其在治病防病方面的运用.本文通过整理、归纳有关燕窝的古籍与近现代文献,针对燕窝的性、味、归经、功效与主治进行探讨,并提出个人的见解,认为:燕窝性平,味甘、淡、咸,归肺、脾、胃、肾经,主要功效为益气化痰,滋肾养肺,补脾和胃以及调补虚劳,主要运用于病机为肺气虚兼痰湿,或肾阴虚为本,肺阴虚为标,或脾气虚,胃气不和,或体虚年老者未病先防、既病防变等相关疾病的治疗.",燕窝,燕窝
青果有效成分的提取工艺研究进展,"江仙凤,陈翠丽,李诺,温海莹,黄秀梅","青果有效成分,提取工艺,黄酮类化合物,多酚类化合物,三萜类化合物,挥发性芳香成分","青果含有丰富的有效成分,具有很好的保健功效,是国家卫生部批准的药食同源的物品之一.该文通过对青果的有效成分黄酮类化合物、多酚类化合物、三萜类化合物和挥发性芳香成分的提取工艺进行总结与分析,以期为青果有效成分的进一步提取优化研究及青果资源的开发与利用提供参考.",青果,青果
分析不同处理方式对当归种子萌发率的影响,"杨远,潘峰,杨帆,赫雪,刘敏,李德政,郭鹏辉","当归种子,萌发率,温水浸种,IAA溶液浸种,大蒜根系分泌物,超声波","当归是中国一味常用的中药材,可药食同源,其栽培历史已有两千多年.为了提高当归种子萌发率,增加药农种植当归及企业种植当归的经济收入,选择一种合理有效的处理措施提升当归种子萌发率则显得至关重要.因此,本研究对温水浸种与-吲哚乙酸(IAA)溶液浸种、大蒜根系分泌物、三种作物根际土壤水浸液以及超声波处理对当归种子萌发的影响进行分析,旨为能提高当归种子萌发率提供一些帮助.","当归, 大蒜","当归, 大蒜"
药食两用滋补保健佳蔬——麻山药,"王亚丽,于文军",,"中国饮食文化有着长远历史,各地美食风味多样.中国的烹饪技术,与医疗保健有密切的联系,在几千年前有“医食同源”和“药食同功”的说法.如果在享受美食的同时,还能起到保健的功效,何乐而不为!为此,一些药食两用佳蔬经美食家精细加工出现在人们的餐桌上,山药便是其中之一.",山药,山药
舌尖养生话五谷,隋欣媛,,"目前国际上流行一句口号叫做“把药房变成厨房”.其实在很久以前,我们的老祖宗就注意到食材里蕴藏的健康玄机,他们将那些带着泥土气息和米面甜香的五谷杂粮视为养生真谛,总结出了“药食同源”“一谷补一脏”的养生食疗法.比如五谷杂粮中的小米可养脾、大豆可养肾、高粱养肝益胃等等.如果每天根据自己的体质,合理适量地食用五谷杂粮,不仅能均衡饮食,更能起到养生的作用,比盲目追崇市面上那些五花八门的保健品更安全更可靠.下面介绍几种五谷杂粮的作用和吃法.",高粱,高粱
盐碱地蒲公英种植技术的研究,牛广林,,"蒲公英是我们日常生活中随处可见的一种植物,其生命力非常旺盛.它属于多年生草本植物,一般大家把它俗称为婆婆丁,是一种不分地域并且营养价值很高的一种野生蔬菜,国家卫生部已经把它列为药食同源食品,它还可以作为药材被使用,不仅可以被用到中药里面,还可以应用于饲料中作为添加剂的原料.根据对一些资料的阅读,发现蒲公英对于醇提物以及水提物都具有抑制细菌的作用.",蒲公英,蒲公英
蒲公英甾醇药理作用研究进展,"葛冰洁,王政,周鸿缘,王萌,张雪梅","蒲公英甾醇,抗炎,抗氧化应激,抗肿瘤,分子机制","蒲公英是一种应用十分广泛的药食同源植物,具有清热解毒、消炎利胆等功效,临床常用于感冒发热、乳腺炎、淋巴腺炎、尿路感染等疾病的治疗.蒲公英甾醇是蒲公英的主要活性成分之一,是一种五环三萜类化合物.近年来,国内外学者研究证实蒲公英甾醇对肝损伤、胃炎、肠炎、肺炎、关节炎以及免疫系统等多种相关疾病具有潜在的防治作用,在体内外均表现出显著的抗炎、抗氧化等药理作用.为了更加全面和深入地了解蒲公英甾醇的药理作用及其机制,论文对其抗炎、抗氧化、抗凋亡及抗肿瘤等作用及机制进行综述.",蒲公英,蒲公英
多花黄精优质高产栽培,"王兴辉,罗华,罗琳",,"多花黄精是国家卫生健康委员会公布的“药食同源”植物,越来越多的中药材种植合作社、大户开始种植多花黄精,新化县、邵东县等多地渐成规模发展._xD_
.产地条件多花黄精常生于阴湿的山地灌木丛及林边草丛中,喜阴,大田种植须遮荫;生长温度以昼温～℃、夜温～℃为佳;以疏松肥沃、土层深厚、pH为.～的黄壤土为佳,但要求水源充足,排灌方便.黏重土、盐碱地及低洼积水地不宜种植.",黄精,黄精
蜂蜜中抗菌活性成分研究进展,"周帆,陈碧霄,杨淼,乔玲,张驰","蜂蜜,抗菌活性成分,研究进展","蜂蜜是我国传统的药食同源食品,有着广为人知的抗菌功效.本文综述了蜂蜜中抗菌活性成分的研究进展,以期为制造出高附加值的蜂蜜产品提供参考.",蜂蜜,蜂蜜
『胃胀气』的自我保健,艾蕾,,"胃胀气是生活中比较常见的一种胃部问题,多由消化不良、胃肠功能失调所致,胃炎、胃溃疡患者常会出现胃胀气,此外,饮食过冷、过热、过硬,暴饮暴食,饮用烈酒、浓咖啡等均可诱发胃胀气.胃胀气主要表现为胃部饱胀感、压迫感,不想吃东西,或伴有胃部胀痛、恶心呕吐、烧心反酸、打嗝喛气等症状.胃胀气多与日常的饮食和生活习惯有关,出现胃胀气后应注意饮食调理,少吃甜品,多吃清淡的食物,积极锻炼身体.此外,我们还可以选择一些有行气作用的药食同源之物,如萝卜、橘饼、陈皮、玫瑰花、山楂、生姜等做成药膳.","橘饼, 陈皮, 玫瑰花, 山楂, 生姜","橘饼, 陈皮, 玫瑰花, 山楂, 生姜"
郑州市蒲公英产业现状、开发利用价值及发展建议,"左红娟,曹辉,黄长志,蒋华","蒲公英,产业现状,开发利用,发展建议","蒲公英是重要的药食同源类中草药资源之一.笔者分析了郑州市蒲公英产业现状,从蒲公英作为蔬菜、药材、饲料、花卉及保健品原材料等几个方面综合分析了蒲公英的开发利用价值,并结合郑州市情况为蒲公英产业发展提出可行性建议,以期为蒲公英产业可持续发展提供理论支撑.",蒲公英,蒲公英
