,Unnamed: 0,Unnamed: 0.1,Unnamed: 0.1.1,Unnamed: 0.1.1.1,Unnamed: 0.1.1.1.1,篇名,作者,关键词,摘要
746,746,746,746,746,746,服中药也要防过敏,常怡勇,"服中药,过敏反应,中药注射剂,药食同源,天然产品,中成药,中草药,西药,丸剂","西药过敏反应司空见惯.不少人以为中药是""纯天然产品"",而且我国自古就""药食同源"",因此认为中药不会过敏.其实,不但中药注射剂、丸剂等中成药可以引起过敏反应,甚至连单味中草药也可以引起过敏反应."
747,747,747,747,747,747,不能随便给孩子吃消食片,蔡建华,"消食片,药食同源,小儿,山楂,山药,口味,家长,多点","如今,很多家长在孩子哭闹时会往孩子嘴里塞一片消食片,他们认为消食片含的是山楂、山药等药食同源的成分,即使吃多点儿,也不碍事.且现在的小儿装消食片口味很好,孩子很喜欢.但这样真的好吗?"
748,748,748,748,748,748,话说药膳,刘北辰,"战国时期,饮膳正要,医食同源,西周时期,五谷为养,史料记载,食疗本草,吕氏春秋,发汗解表,求长生,调味品,脏器,益气,药膳,素问,气味,配膳,历史,后妃,宫廷","据有关史料记载,药膳在我国有着悠久的历史,早在西周时期,宫廷内就有""食医""专门为帝王后妃们配膳,以求长生不老.战国时期的<吕氏春秋>在<本味篇>中就有姜、桂是调味品,也是发汗解表之药的记载.""食疗本草""、""饮膳正要""等词汇古已有之.<素问·脏器法时论>中记载,""五谷为养、五果为助、五畜为宜、五菜为充,气味合而服之,经补精益气""也都阐明了""医食同源""的道理."
749,749,749,749,749,749,夏季健康养生应多吃五谷杂粮,千紫,"夏季,健康,养生,糖尿病患者,药食同源,五谷杂粮,烹调方法,经济实用,健脾和胃,防治疾病,大米,补中益气,副作用,中医,药性,血糖,粳米,功效","中医有""药食同源""的说法,五谷杂粮的药性既可防治疾病,又经济实用,且没有副作用._xD_
大米:又名粳米,味甘性平,具有补中益气、健脾和胃、除烦渴的功效.特别需要提醒糖尿病患者的是,大米不同的烹调方法对血糖的影响不同."
750,750,750,750,750,750,营养素与慢性病,沙国英,"营养素,亚健康人群,世界卫生组织,亚健康状态,中西结合,药食同源,生命,临床症状,营养学,维生素,慢性病,中医,元素,医学,西医,焦点,基础","营养学是医学的基础,中西结合起来的焦点也在于营养素,因为中医讲药食同源,西医讲维生素是维持生命的元素.慢性病有的临床症状不明显,是处于生命的亚健康状态.世界卫生组织宣称健康的人占人群的%,有病的人占人群的%,亚健康人群占人群的%._xD_
"
751,751,751,751,751,751,"老姜茶,新价值",焦军,"姜茶,生理活性物质,多种微量元素,药食同源,血液循环,现代医学,多种功能,保健食品,医学家,维生素,蛋白质,症状,晕车,营养,生姜,祛湿,祛寒,姜油,姜酚,加速","生姜自古被医学家视为药食同源的保健食品.现代医学发现其含有姜油、姜酚、姜酶等生理活性物质和蛋白质、多糖、维生素及多种微量元素,集营养、调味、保健于一身,具有祛寒、祛湿、暖胃、加速血液循环、防癌、减轻晕车症状等多种功能."
752,752,752,752,752,752,"看《孔子》,学习居家备中药",张三,"《孔子》,学习,中药,药食同源,疗效确切,古代医家,功效主治,不可分,药物,药补,养生,食物,食补,时间,圣言,生活,社会,电影,地位,春节","由周润发,周迅主演的电影<孔子>今年春节期间持续上映,让百姓了解到一个真实而又完整的孔子.孔子一生大部分时间不得志,经历了许多生活纷扰,可是他仍活了岁.在当时来说,可谓身健寿长.综观孔子的圣言范行,其长寿.之道与中药养生密不可分,我国有""药食同源""之说,古代医家也常把食物的功效主治与药物等同起来,并提出""药补不如食补""的主张,从而证实了食医在社会中的重要地位.下面推荐的十种中药,它们不仅易于保存,而且疗效确切."
753,753,753,753,753,753,冬季话饮食药膳,徐辉,"冬季,饮食原则,身体健康,营养需求量,营养物质,医食同源,药食同用,延年益寿,物质代谢,食物,免疫机能,防治疾病,散热量,老年人,供热量,药物,药膳,心气,五脏,温补","寒冷的冬季,人体散热量增加,物质代谢和各种营养需求量发生变化,会对免疫机能较差者和老年人的身体健康带来一定影响.此时除身体御寒外,更重要的是通过饮食为自身提供热量和各种营养物质.科学地运用""医食同源,药食同用""的原理,本着""五脏属肾,宜温补,肾色黑,宜食辛、宜减成增苦以养心气""的饮食原则,恪守""不宜进寒凉食物"",利用食物与药物来滋养身体,可达到防治疾病、延年益寿的目的.下面为您推荐几种冬季暖身药膳."
754,754,754,754,754,754,一碗汤的幸福,琪琪,"养生之道,药食同源,养生文化,完美结合,气候环境,现代人,多商家,中医,体质,四季,流传,改良,创新,不变","时下,很多商家正在大力追捧一种流传千年的养生文化-汤.他们将中医和现代养生之道完美结合,强调四季五补、药食同源,根据现代气候环境和现代人体质,对汤进行改良和创新,不变的是""以养生为根本""."
755,755,755,755,755,755,粥疗咳喘,周青前,"慢性支气管炎,药食同源,清热化痰,粳米,肺热咳嗽,煮粥,中风,制作,淘洗,食物,食品,食疗,加水,锅内","粥是人们常吃的食物,居家时可据需要适当添加一些药食同源的食品,制作不同的食疗便方._xD_
竹沥粥--竹沥毫升,粳米克.将粳米淘洗干净,放入锅内,加水煮粥,待粥将熟时,调入竹沥,稍煮即可.分次服食.能清热化痰.适用于肺热咳嗽痰多,中风、喉间痰声辘辘,慢性支气管炎咳吐脓痰、胸中大热烦渴."
756,756,756,756,756,756,十九种食物帮你对抗十九种疾病,仁源,"食物,对抗,治疗疾病,医学理论,医食同源,药食同源,日常生活,中草药,药物,性能,水果,蔬菜,食品","祖国传统医学理论认为""医食同源"",""药食同源"",很多中草药,既可作为治疗疾病的药物,同时也是很好的食品,就是我们日常生活中的很多蔬菜、水果常常也都同时具有食与药两方面的性能."
757,757,757,757,757,757,新食面生产线提升面制品价值,关颖,"生产线,面制品行业,杂粮,营养保健功效,深加工设备,整体提升,有限公司,药食同源,温饱问题,保健食品,加工生产,保健功能,现代化,生命力,健康化,多样化,注入,中国,天津,疗效","人们在温饱问题已经解决的时候,要求所吃的粮食多样化、健康化.杂粮属于""药食同源""的食品,不同杂粮有不同的营养保健功效.圣昂达机械(天津)有限公司研发的新食面生产线是一套现代化的杂粮深加工设备,经其加工生产的新食面,食疗效果好、保健功能强,被人们誉为""保健食品"",为中国面制品行业价值的整体提升注入了新的生命力."
758,758,758,758,758,758,儿子是个中医迷,史峰,"药食同源,兴趣,电视节目,中医,健康,含义,词语","真是想不到儿子竟然对中医产生了浓厚的兴趣,这都源于儿子对一个词语的兴趣--_xD_
有一次,儿子看电视节目<健康之路>时,偶然听到了一个词叫""药食同源"".这个词对儿子来说相当生疏,他没有听懂其中含义,事后便问我:""爸爸,什么叫药食同源?"""
759,759,759,759,759,759,霸王集团的多元化发展之路,张三,"霸王,多元化发展,原料配方,中草药,药食同源,凉茶,产品定位,饮用,饮品,饮料,口味","且看霸王凉茶如何做?首先,在产品定位上,霸王凉茶--不仅仅仅是一种独特的中草药饮品,而更多的是适合随时随地、日常饮用的饮料,这点从其原料配方上可以看出端倪.其原料配方不仅都采用了药食同源的中草药食材,而且在口味上"
760,760,760,760,760,760,佛手的研究进展,"张思荻,杨海燕,曾俊,李敏","佛手,应用开发,药食同源品,大健康产业","佛手为我国传统的药食两用中药材之一,亦可作为盆景观赏,其提取物还被广泛用于食品和日化用品,具有广阔的开发应用前景.佛手中主要含有挥发油、黄酮类、多糖等化学成分,目前对佛手的研究主要集中于总成分的测定分析和药理作用方面,而对其单体成分的药理作用机制尚不明确.佛手具有祛痰、止咳、平喘作用,还具有抗炎、抗菌、降血压、抗癌、抗抑郁的作用.文章综述了佛手的本草、资源、应用现状以及研究进展,在此基础上提出佛手利用新思路,以期为佛手的研究及开发应用提供参考."
761,761,761,761,761,761,中医药治疗高血压前期的经验,"玄欣彤,蒋卫民","高血压前期,眩晕,头痛健康管理,中医中药,药食同源","近年来高血压前期概念多次被提及,国际上明确定义高血压前期是指收缩压mmHg～mmHg和/或舒张压mmHg～mmHg.高血压前期是从正常血压向确诊临床高血压病过度的一个前驱阶段,也是避免进一步心脑血管疾病产生的重要阶段.因此,早期、及时、有效地干预高血压前期发展为血压病,既是对高血压前期病人的充分健康保障,又是中医学“治未病”预防思想的具体表现.结合中医中药疗法改善高血压前期病人的治疗经验及体会,进一步探讨高血压前期的防治措施."
762,762,762,762,762,762,中药复方对早期糖尿病肾病大鼠血糖及肾脏糖代谢的影响,"胡力文,刘银,庞钰鑫,赵婉妤,苏笮斌,许欣,裴晓方","糖尿病肾病,血糖,糖代谢,中药复方,药食同源","目的研究中药复方对早期糖尿病肾病大鼠血糖及肾脏糖代谢的影响.方法只SD雄性大鼠,随机选取只大鼠设置为正常对照组,其余只大鼠通过腹腔注射STZ,喂以高脂高糖饲料进行造模.模型鼠随机分为阳性对照组(mg/kg·bw,盐酸二甲双胍)、模型对照组(蒸馏水)、低剂量组(.g/kg·bw,中药复方)、中剂量组(.g/kg·bw,中药复方)、高剂量组(.g/kg·bw,中药复方).灌胃d后,采集血液和肾脏标本,采用自动生化分析仪检测每组大鼠Glu、HbAc含量,酶联免疫吸附法和化学法分别测定大鼠肾组织中AR和Na+-K+-ATP表达水平.结果低、中和高剂量组Glu差值高于模型对照组(均P＜.);低剂量组Hbac水平低于模型对照组(P＜.);中剂量和高剂量组AR活性低于模型对照组(均P＜.);各剂量组大鼠肾脏组织中Na+-K+-ATP水平差异无统计学意义(均P＞.).结论该中药复方可降低早期糖尿病肾病大鼠Glu和HbAlc水平,同时通过减少AR的表达进而抑制多元醇通路来减缓DN的发展."
763,763,763,763,763,763,某中药复方对早期糖尿病肾病大鼠肾组织肾素-血管紧张素系统的影响因素初探,"刘银,苏笮斌,胡力文,庞钰鑫,赵婉妤,许欣,裴晓方","糖尿病肾病,肾素-血管紧张素系统,中药复方,药食同源","目的研究中药复方对早期糖尿病肾病大鼠肾功能保护作用及其对肾脏肾素-血管紧张素系统的影响.方法从同批次SPF级SD雄性大鼠中随机选取只大鼠作为正常对照组,其余大鼠腹腔注射小剂量STZ辅以高脂高糖饲料饲喂造模,模型鼠随机分为阳性对照组(mg/kg·bw,盐酸二甲双胍)、模型对照组(蒸馏水)、中药复方.g/kg·bw、.g/kg·bw和.g/kg·bw,每组只.灌胃d后,采集尿液、血液和肾脏标本,采用全自动生化分析仪检测每组大鼠尿液中Ucr和血液中Scr、BUN水平,化学法测定肾组织中NO含量,酶联免疫法测定肾组织中ACE、Ang-II和ET-表达.结果低剂量、中剂量和高剂量组肌酐清除率高于模型对照组(P＜.),低剂量和中剂量组BUN水平低于模型对照组(P＜.),低剂量、中剂量和高剂量组ACE水平低于模型对照组(P＜.),低剂量和中剂量组Ang-II水平低于模型对照组(P＜.).结论该中药复方对实验性早期DN大鼠肾功能有保护作用,能抑制DN状态下异常活化的肾脏RAS,恢复血流动力学稳态."
764,764,764,764,764,764,药食两用中药对型糖尿病治疗的研究进展,许琳,"药食同源,糖尿病,作用机制,研究进展","糖尿病是一种常见的、有遗传倾向的,以慢性高血糖为特征的终身性代谢性疾病.在我国,中药具有治疗糖尿病的悠久历史,具有深厚的实践基础和广泛的社会影响,不良反应小.本文就近年来具有代表性的降糖中药及其作用机制进行了整理综述,为今后降糖药物研究提供参考."
765,765,765,765,765,765,干姜、粉葛、白芷中二氧化硫残留量的检测分析,"王成芳,赵于芳,王颖莉","酸碱滴定法,离子色谱法,二氧化硫,药食同源,脱硫","应用酸碱滴定法和离子色谱法定量检测干姜、粉葛、白芷中二氧化硫残留量.检测结果显示,种样品中二氧化硫含量均偏高,超过药典里相关规定;离子色谱法硫酸根进样质量浓度在.μg/L～μg,/L范围内与硫酸根色谱峰面积有良好线性关系;酸碱滴定法和离子色谱法均能用于种样品中二氧化硫测定,离子色谱法测得值较高."
766,766,766,766,766,766,陈建萍从肝论治乳腺癌思路与经验,"游杰舒,刘焕兰","乳腺癌,从肝论治,养肝,柔肝,疏肝,药食同源,陈建萍","陈建萍博士为香港大学中医药学院副教授,现任世界中联乳腺病专业委员会第一届理事会副会长,中华中医药学会乳腺病分会第一届委员会常务委员,全国中西医结合乳腺病专业委员会委员.其从事乳腺癌临床及基础研究二十余载,在乳腺癌治疗方面积累了丰富的经验,有系统而独特的见解.笔者有幸跟师侍诊,受益匪浅.现简要总结陈建萍通过养肝、柔肝以达""疏肝"",治疗乳腺癌的独特理念,以及结合现代医学治疗乳腺癌的经验,为进一步拓展乳腺癌临床治疗提供思路和方法."
767,767,767,767,767,767,基于ROC曲线的中药致敏风险预测模型研究,"谢晴宇,孟庆刚,王忠","致敏预测,药食同源,CFDA药物不良反应警戒,ROC曲线","目的:探索中药成分致敏性与总脱靶数量及致敏脱靶数量的关系.方法:参考《按照传统既是食品又是中药材物质目录管理办法》的中药形成“安全中药成分数据集”.参考CFDA发布的药品不良反应信息通报,确定有致敏风险的中成药品种,作为“致敏风险中成药数据集”.对两组中药成分进行抽样和脱靶预测(主要预测总脱靶数量及致敏脱靶数量两项指标),其后,进行ROC曲线分析,探索种模型预测成分致敏风险的最优临界值(cutoff).结果:致敏成分组与安全成分组总脱靶数量和致敏脱靶数量相比均具有统计学差异(P＜.).结论:由总脱靶个数和致敏脱靶个数共同建立的综合预测指标具有最好的预测准确度(AUC=.)."
768,768,768,768,768,768,药食两用中草药在防治高尿酸血症上的研究进展,"郭花斌,辛宝","高尿酸血症,药食同源中草药,黄嘌呤氧化酶","随着社会发展和人类生活水平的提高,高尿酸血症的发病逐年上升且出现低龄化趋势.高尿酸血症是痛风等许多代谢性疾病的诱因之一,西药在治疗高尿酸血症上主要有丙磺舒、苯溴马隆、非布司他等药物,近年关于治疗高尿酸血症西药的毒副反应及不良事件屡见不鲜.为弥补西药的不足,从药食两用的中草药中来寻找防治高尿酸血症的中药."
769,769,769,769,769,769,维药鹰嘴豆皂苷提取物降血糖作用研究,"阿里米热·阿迪力,邹颖萍,李庆宇,马晓云,赵擎,栗敏","维药鹰嘴豆,小鼠,降血糖作用,药食同源","目的研究并探索维药鹰嘴豆皂苷提取物对小鼠降血糖的作用.方法选取只健康小鼠,将其随机分为对照组、损伤组、低剂量保护组和高剂量保护组,除对照组外其余三组小鼠均使用链脲佐菌素辅以高糖高脂饲料使其成为高血糖模型组,再分别对其保护组灌胃不同浓度剂量的鹰嘴豆皂苷提取物进行保护,在实验的不同时段对其体重与血糖进行测定.结果低剂量保护组与高剂量保护组小鼠不同时段体重出现变化(P<.);不同阶段对小鼠的血糖比较,对照组差异不具有统计学意义(P>.);而低剂量保护组差异具有统计学意义(P<.).结论维药鹰嘴豆皂苷提取物对小鼠高血糖有很好的降低作用,且随着鹰嘴豆皂苷提取物使用浓度越大,其保护作用越强,建议使用饮食控制糖尿病时可以让患者多食用鹰嘴豆,更好的控制血糖,减轻病情."
770,770,770,770,770,770,大自然的馈赠:味之道与民族医药,赖立里,"礼物,民族医药,药食同源,拉图尔,行动元网络","民族地区医师的采药配方与厨师调和五味的技艺之间关联密切.被称为“大自然馈赠”的不仅有药材与食材,还有体现了医者与厨师调配技艺的“味之道”.按照人类学经典的“礼物”逻辑,在行医与烹饪实践中,味道作为赠予的礼物,融入了病人与食客的身体生命之中.这也是民族医药实践中人与物共同形成的“行动元网络”.它既包含了本身源于自然的药材,也包含了与之相关的人类技艺与实践.如此来重新认识行医和烹饪过程,可以看到拉图尔意义上的超越了以人为中心、不限于语言和人际交流的社会生活.民族医药实践是将各方力量汇聚在一起的过程,指向的是关于生的宇宙观的实践,并非简单的商品交换逻辑可以完全代替."
771,771,771,771,771,771,试论中医方法在家庭保健的应用,邹玲,"中医,艾灸,拔罐,药食同源,循经取穴胶布疗法","中医历史悠久,中华民族的传统医学内容极其丰富多彩,古典医药文献之富,有效医疗技术之多,理论之独具特点.简析艾灸、拔罐、循经取穴胶布疗法之类中医方法在家庭保健的应用."
772,772,772,772,772,772,食物治病：《食疗本草》,王家葵,《食疗本草》修务训觅药行为避就农耕时代艰难时世保健养生采捕药食同源知所,"＂药食同源＂为保健养生家津津乐道,却很少有人去追问,药物与食物在其发生发展过程中,究竟是怎样一种关系。农耕时代以前,食物主通过采捕获得,渔猎需体力,采集更需智慧。《淮南子·修务训》说：＂（神农）尝百草之滋味,水泉之甘苦,令民知所避就。当此之时,一日而遇七十毒。＂可算是对艰难时世的追忆。药物的出现,基于人类有意识的觅药行为,这一过程确实与觅食有关。"
773,773,773,773,773,773,三七茎叶、三七花新食品原料研究,"杨光,崔秀明,陈敏,黄璐琦,曲媛,阙灵","新食品原料,三七茎叶,三七花,药食同源","目的三七茎叶、三七花作为新食品原料的安全性和可行性研究.方法研究总结三七茎叶、三七花的食用历史、营养成分和质量可控标准,采用小鼠毒理实验验证其安全性.结果三七茎叶、三七花食用历史悠久,富含维生素、矿物质、蛋白质、氨基酸等多种营养成分,实验结果表明,安全无毒、无明显脏器损伤.结论将三七茎叶、三七花作为新食品原料在推荐剂量下食用不具有健康风险,开发前景广阔,对其他中药材的非药用部位综合开发利用具有参考价值."
774,774,774,774,774,774,雪菊化学成分及药理作用的研究现状,"黄伟,刘润駉,夏靓,黄晓珊","雪菊,化学成分,药理作用,药食同源,活性药物","雪菊学名蛇目菊、两色金鸡菊,是金鸡菊属植物两色金鸡菊分布在我国昆仑山地区海拔米左右的野生品.雪菊含有黄酮类、氨基酸、挥发油、糖类等多种化学成分,具有降血压、降血脂、抗衰老、抗肿瘤等药用价值.文章从雪菊的化学成分、药理作用等方面进行了综述,阐明了雪菊的研究现状,展望了其开发利用的前景."
775,775,775,775,775,775,野生茄属资源——水茄的开发利用,"苏婉玉,王艳芳,曹绍玉,张琳,许俊强,张应华","水茄,茄属资源,药食同源,野生蔬菜","综述了水茄的生物学特性及分布、开发价值(药理作用、食用价值、育种栽培和观赏价值)与繁殖技术(播种育苗、扦插繁殖、分蘖繁殖和组织培养繁殖),并对水茄的开发利用进行了展望."
776,776,776,776,776,776,UFLC-QTRAP-MS/MS法测定绞股蓝中个核苷类成分,"马赟,蔡静,张园娇,纪乐军,陈建伟,李祥","绞股蓝,药食同源,胸苷,尿苷,腺苷,肌苷,'-脱氧鸟苷,鸟苷,腺嘌呤,次黄嘌呤,尿嘧啶,鸟嘌呤,高分离度快速液相色谱质谱联用","目的:建立UFLC-QTRAP-MS/MS的方法,同时测定不同产地绞股蓝及其商品药材中个化合物(胸苷、尿苷、腺苷、肌苷、'-脱氧鸟苷、鸟苷、腺嘌呤、次黄嘌呤、尿嘧啶、鸟嘌呤)的含量.方法:采用XBridgeAmide色谱柱(.mm×mm,.μm),以.％甲酸水溶液(A)-.％甲酸乙腈溶液(B)为流动相,.mL·min-流速梯度洗脱,正离子(ESI+)模式下多反应监测(MRM)检测.结果:尿嘧啶、胸苷、尿苷、次黄嘌呤、肌苷、'-脱氧鸟苷、腺苷、鸟苷、腺嘌呤、鸟嘌呤的线性范围分别为.～.、.～.、.～.、.～.、.～.、.～.、.～.、.～.、.～.、.～.ng·mL-(r＞.),平均加样回收率为.％～.％,含量分别为.～.、.～.、.～.、.～.、.～.、.～.、.～.、.～.、.～.、.～.μg·g-,绞股蓝中以尿嘧啶、尿苷、鸟苷、鸟嘌呤含量较高;不同产地及商品药材中个成分含量有所差异.结论:该方法为绞股蓝药材内在质量的综合评价提供新的科学依据."
777,777,777,777,777,777,中草药提取物复方配伍在中医临床和保健食品上的应用效果探析,"杨立,杨勇,杨亮,王千金,汤小俐","中草药(新型原料药),""药食同源""提取物复方配伍,""理、法、方、药""理论的有机融合,更能体现中医治疗的精准性","目的探析在中医临床和保健食品上应用中草药提取物的应用效果.方法在临床上的治疗中应用四例疾病的病例,进行临床上的治疗分析,观察患者在临床上的治疗效果.结果四个例子中的患者在接受中草药临床治疗中的提取物治疗后,临床上的症状消失,健康状态逐渐恢复.结论中医临床和保健食品在临床上应用中草药提取物,能够有效的消除患者临床上的症状,提高患者的生活质量,临床治疗效果显著."
778,778,778,778,778,778,川产道地药食资源石榴的保健功能与开发利用,"李佳川,陶梦敏,许世林,邵君傲","石榴,药食同源,营养保健,开发利用","目的:以川产道地药食资源石榴为对象,深入探讨石榴的保健功能与开发利用现状,并提出相关建议和思路.方法:采用文献复习、专利查阅以及数据分析等多种方法,对石榴的药食资源部位、生物活性成分、药效保健功能,以及相关产品的专利及开发利用现状进行了大量分析与总结.结果:石榴活性成分丰富,药理作用广泛,药食保健价值巨大,具有广阔的应用开发前景.结论:深入开展川产道地药食资源会理石榴的精深加工与开发利用,将有助于促进攀西地区特色食药生物资源的开发与产业化发展,促进区域协调持续发展,提高民族区域经济效益."
779,779,779,779,779,779,决明方治疗非酒精性脂肪性肝病的临床观察,"谢慧,陆敏,樊欣钰","非酒精性脂肪性肝病,中医药疗法,决明方,药食同源,名老中医","目的观察全国名老中医验方决明方治疗非酒精性脂肪性肝病的临床疗效.方法随机选取例非酒精性脂肪性肝病患者,均服用决明方治疗,疗程为周,观察临床症状、肝脏酶学、血脂水平的变化.结果决明方能明显改善非酒精性脂肪性肝病患者的临床症状,总有效率为.％,尤其对胁肋胀痛、口干口苦或口粘、周身困重等症状疗效显著(P＜.).决明方对肝脏酶学及血脂指标均有一定程度的改善,治疗后患者肝脏酶学ALT有效率.％,血脂指标TC、TG有效率.％,肝脏酶学及血脂总有效率为.％.结论决明方治疗非酒精性脂肪性肝病有较好的临床疗效."
780,780,780,780,780,780,三种药食原料对乳酸菌生长及抗氧化的影响,"王聪,廖萌,张喆,吴正云","药食同源,泡菜,乳酸菌,发酵,抗氧化","以紫苏、生姜和花椒三种药食两用材料为研究对象,探讨了它们对泡菜乳酸菌生长及其抗氧化性能的影响.研究结果显示,添加食材提取液能促进泡菜乳酸菌在白菜汁培养基中的生长及发酵液均抗氧化活性的提高,其中,添加紫苏提取液的抗氧化能力综合最高;添加生姜提取液的抗氧化能力受提取剂和发酵时间的影响较明显;添加花椒提取液的抗氧化能力最稳定,经过h发酵,三种食材的抗氧化活性均有所提高.总体而言三种食材均适合用于泡菜发酵."
