,Unnamed: 0,Unnamed: 0.1,Unnamed: 0.1.1,Unnamed: 0.1.1.1,Unnamed: 0.1.1.1.1,篇名,作者,关键词,摘要
2185,2185,2185,2185,2185,2185,重症肌无力患者留置胃管的饮食调护,卜海玲,"重症肌无力,留置胃管,饮食调护,瘘证","总结例重症肌无力患者留置胃管期间的饮食调护,认为该病饮食护理的要点是结合中医药食同源,正确给予患者鼻饲高纤维、高蛋白,易消化吸收的流质饮食,以帮助患者度过肌无力危象.护士熟练掌握合理饮食调护,积极配合医生救治可以改善临床症状,对促进患者早日康复,减少病情反复及对延长重症肌无力患者生命也起着重要作用."
2186,2186,2186,2186,2186,2186,浅析杀菌剂在人参上的合理应用,"王刚,张艳梅,郑芝强",,"近几年随着人参种植水平的不断提高,以及人参药食同源进程的推进,人参产品的农药含量检测指标由原来的六六六、DDT、五氯硝基苯及重金属检测,升级到各种使用农药残留的检测,所以在人参栽培过程中,化学农药的使用结构发生着变化,一些质优价廉、低残留、药效好的新型杀菌剂及其复配制剂的应用数量在明显上升,高毒高残留的杀菌剂需求明显减少.在人参种植过程中,对人参病虫害的合理的预防和治理是提高人参产量和保障质量的关键.这就要求杀菌剂使用时,不仅要充分了解病害的发生和发展规律,还要明确杀菌剂的作用、性质及使用方法,才能最大限度地发挥杀菌剂的功效.经过几年的病害防治实验及观察,对各类杀菌剂的作用归纳总结如下."
2187,2187,2187,2187,2187,2187,吃中药零食要看体质选择,邓莹莹,,"中药零食,通常是指含有中药成分的零食,其中的中药成分是经卫生部门许可的药食同源范围内的可添加物品.中药零食不等同于传统意义上的民间偏方,严格来说还是一种食品.最常见的此类食品主要有龟苓膏、阿胶枣、茯苓饼、陈皮等._xD_
吃中药零食并非人人适合,也要辨证、因人而异._xD_
.阿胶枣.阿胶和红枣都有滋阴、养血、补血的作用,很受女性朋友的喜爱.阿胶枣有补益的作用,对于气虚或血虚的人有一定好处,能改善面色苍白、浑身没劲、经常犯困等症状.但阿胶枣偏温性,对体内有湿热的人不适合.如果舌苔厚、腻、黄,大便干燥,爱上火,那就应少吃阿胶枣."
2188,2188,2188,2188,2188,2188,安化黑茶药用价值小议,"汤艳,易健,彭千元,吴琨鹏,刘柏炎","黑茶,中医药,药用价值","中医药源自中国古代,而茶叶也最早产于中国,它们均是中华民族的宝贵财富,亦是炎黄子孙的骄傲.在药食同源的古代,许多中药既是药材又是食材,两者密不可分,茶叶作为我国传统食材之一,同时,也是一味常用中药,有它独特的功效.现代研究也表明,茶叶具有抗氧化、抗肿瘤、降脂等多重功效.黑茶作为一类后发酵茶,因其特殊的加工工艺而有别于其他茶类,文章将重点探讨茶叶、黑茶在中医学中的特殊功效,以及黑茶的药用机制."
2189,2189,2189,2189,2189,2189,福建药食两用果品研究进展,"郭丽宏,黄俗常,方文清","福建,药食两用,果品,综述","由于得天独厚的自然气候条件,福建素来被称为""水果之乡"".大多数果品不仅酸甜可口,还具有较高的营养价值,对预防疾病,增进健康有着不容忽视的作用;同时,正如中医之精髓所言""药食同源"",丽果也是良药.因此,整理介绍福建地区常见的药食两用果品及其食用营养与药用疗效,为其进一步利用提供依据."
2190,2190,2190,2190,2190,2190,金樱子总黄酮提取工艺与生物活性,"莫奉喜,董伟","金樱子,总黄酮,提取,生物活性","金樱子具有药食同源的特点,在我国中药方剂以及食品工业中应用较多,其所含的黄酮类成分近年来备受关注.根据已有的文献报道,本文综述了金樱子总黄酮的提取以及生物活性等内容,为金樱子总黄酮的进一步研究与利用提供科学依据."
2191,2191,2191,2191,2191,2191,话陈皮,梁社坚,,"“千年人参,百年陈皮”,“百年陈皮胜黄金”,这是自古以来陈皮给人的印象,既展示了陈皮的价格,又道出了陈皮的内涵——越陈越香,越陈越有价值._xD_
中医药具有自己独特的文化艺术性格——中庸,以平为期,以和为贵,而陈皮则体现了最完整、最典型的和药特性:祛湿、健脾、养胃、疏肝、行气.陈皮在中药上是标准的和法养生,在食材上是调和保健,药食同源.在健康理念和养生之道盛行的今天,陈皮以其独特的传统特质和功效,越来越受到广大民众的重视和青睐."
2192,2192,2192,2192,2192,2192,蒙医传统酸马奶工艺的现代化生产线研究,包秀萍,"酸马奶,蒙医,生产工艺","蒙医传统酸马奶富含丰富的蛋白质,氨基酸和各种微量元素,不仅是药食同源的健康绿色的饮品,而且是蒙医传统特色疗法之一而广泛应用于临床,能治疗多种疾病,板具价值.在全面了解传统酸马奶发酵制做手法的基础上,更深入的整理和改革了传统制作工艺,统一酸马奶的口感和品质,促进其产品的研发与营养价值的分析,以及达到节省人力,批量生产的现代需求."
2193,2193,2193,2193,2193,2193,饮食调养在肝病中的应用,"李东垚,刘立群","饮食调养,肝病","肝脏是人体最大的消化腺,是人体糖类、脂类、蛋白质消化、吸收及代谢的重要器官.中医认为肝脏的生理功能为主疏泄和主藏血,其中主疏泄又涉及调畅气机、促进脾胃的运化功能,如果长期饮食失节,情志不遂,肝气不舒,肝气郁滞,再加之人体正气不足,致肝失疏泄,脾失健运,痰浊积聚,胁络痹阻,血行不畅,瘀血停积,逐渐形成肝炎、脂肪肝、肝硬化或肝癌.肝病药物治疗主要,但饮食调养也很重要,中医学认为药食同源,对于肝病的治疗来说,食疗的重要性并不亚于药疗,食疗的总的原则是宜进食清淡、易消化、富有营养,富含维生素和矿物质,摄入的热量宜以维持正常体重为标准.热量过低会使体重下降,影响肝组织的修复能力;热量过高可导致身体肥胖.戒烟戒酒尤为重要,酒及含有酒精的饮料,能引起肝细胞充血、水肿、变性、坏死,增加肝脏负担,易造成肝功能恶化.下面分别阐述."
2194,2194,2194,2194,2194,2194,蔓越莓预防妇科、疾病?别逗了!,云无心,,"蔓越莓与尿路感染_xD_
蔓越莓原产于北美,是一种常绿矮灌木所结的浆果.它是北美人民传统的“药食同源”产品,用于一些食品中,也用于治疗多种症状,其中最有名的当属防治尿路感染.尿路感染是由细菌引起的,最早有医生解释蔓越莓的作用,说是它可以把尿的酸度降低到足以杀灭细菌的程度(pH值越低,意味着酸性越强).这一解释曾经被很多人接受,但显然很可疑:尿来源于所有的饮食,要靠蔓越莓把它的酸度降到能杀菌,似乎实在太想当然了一些."
2195,2195,2195,2195,2195,2195,中药真的没有毒副作用吗,王猛,,"一提起中药,人们挂在嘴边的话往往是“吃中药好,没有副作用”,“你看西药说明书上写了那么多副作用,都不敢吃了,还是中药好,副作用小”,“西医治标,中医治本,中药药食同源,绿色无害”,这些话听得多了,人们也不去深究其中的道理,人云亦云,但医学是一门科学,在目前的科技发展水平下,有些事情需要重新认识."
2196,2196,2196,2196,2196,2196,细说『蚝门』,康媛,,"牡蛎,既是食物,也可入药,因含有丰富的锌及铁、磷、钙、优质蛋白质、糖类等多种营养素,是药食同源的优秀食材,有“海底牛奶”的美誉.牡蛎盛产于温带和热带各大洋沿岸水域,在我国沿海一带均有分布,南粤称其为“蚝”,闽南称之为“蛎房”,北方渔民管它叫“海蛎”“石蛎”._xD_
中医认为,牡蛎肉味甘,性平.有养血安神,软坚消肿作用.主治烦热失眠,心神不安,瘰病.因为肉质肥美爽滑,营养价值丰富,牡蛎早在公元前就已被老饕青睐,视其为美味海珍."
2197,2197,2197,2197,2197,2197,葛根提取液防腐性能的研究,"杨志萍,吴涛,王博,綦国红,王岁楼","葛根,防腐,抑菌,MIC,pH,热稳定性","以药食同源植物葛根为原料,选用金黄色葡萄球菌、枯草芽孢杆菌、大肠杆菌、根霉、曲霉和酵母六种常见食品腐败菌为目标菌株,采用醇提的方式获得葛根提取液,对葛根提取液的防腐性能进行测定,确定了目标菌株的最低抑菌浓度(theminimuminhibitionconcentration,MIC),并研究了pH和温度对其抑菌活性的影响.实验结果表明:葛根提取液对除酵母外的菌株都有一定的抑制作用,对不同目标菌株的MIC分别为.g/mL(大肠杆菌、根霉)和.g/mL(金黄色葡萄球菌、枯草芽孢杆菌和曲霉);抑菌液具有良好的热稳定性,且在pH～的范围内呈现出较好的抑菌作用."
2198,2198,2198,2198,2198,2198,好吃又降糖的中医糖尿病食谱,方朝晖,,"中医文化源远流长,深受人们的推崇,在饮食养生方面也有着独到的见解.中医讲究药食同源,药食同补.中医认为,脾胃为水谷之海,后天之本,气血生化之源.千百年来,历代医家不仅发现了很多益寿延年的保健药物,积累了丰富的经验,为人类的健康长寿做出了巨大贡献._xD_
糖尿病是以口干多饮,多食,多尿,或伴体重减轻甚至消瘦为主要临床表现的一种慢性疾病.良好的饮食控制是糖尿病所有治疗的基础,是糖尿病自然病程中任何阶段控制病情以及预防和减少各种并发症必不可少的措施.初夏来临,就为大家推荐几款适合糖尿病友的饮品."
2199,2199,2199,2199,2199,2199,草本花卉马齿苋栽培技术,"兰丽薇,李新",,"一、引言_xD_
马齿苋(PortulacaoleraceaL.)为马齿苋科马齿苋属年生草本植物.又名太阳光、马齿菜、松叶牡丹、半支莲、死不了、草杜鹃等.马齿苋是一种常用中草药,也是普通百姓喜欢食用的野生蔬菜,它是被医药界和食品界公认的一种""药食同源""的植物.近年研究表明,无论从药理作用还是从食用保健看,马齿苋都是一种不可多得的良药和天然绿色佳蔬.因此,它是一种很有发展前途的绿色保健蔬菜,也是一种具观赏性和实用性的药用花卉."
2200,2200,2200,2200,2200,2200,道地药材巨鹿枸杞发展现状及建议,袁园,,"枸杞是我国历史悠久的药食同源品种,具有滋补肝肾、益精明目之功效.中医主要将枸杞用于肝肾阴虚、头晕目眩、视物昏花、遗精阳痿、腰膝酸软、虚劳嗽、消渴等症._xD_
枸杞的起源_xD_
枸杞最早的历史记录在《名医别录》,为“常山及诸丘陵阪岸上”.《本草经集注》记载:“生常山平泽,及诸丘陵阪岸上,今出堂邑,而石头烽火楼下最多”."
2201,2201,2201,2201,2201,2201,山药滴灌栽培技术,南满良,"山药,滴灌,高产,栽培,技术","山药是营养价值很高的药食同源食品,滴灌种植山药产量高,经济效益显著,种植山药是职工农户多元增收致富的好路子."
2202,2202,2202,2202,2202,2202,黄精资源培育及深加工关键技术,汤锋,,"随着生活水平的提高,人们越来越关注健康问题,健康产业成为最具发展前景和潜力的行业之一.黄精是一种药食同源的名贵中草药,富含多糖、皂甙等多种活性成分,具有调节血糖和血脂、抗疲劳、抗氧化、免疫调节和延缓衰老等保健功能.多年来,黄精主要依赖野生资源,并以原材料或初加工产品形式销售.掠夺性利用资源致使生态环境遭到破坏、资源有效利用率低、原材料浪费严重、产品科技含量低以及功能性保健产品少等制约产业发展的瓶颈问题长期存在."
2203,2203,2203,2203,2203,2203,“养生粉”岂可乱配乱喝,郑金美,,"祛湿排毒减肥,吃根豆粉;手脚冰凉,喝红豆薏仁粉;抗衰老乌发健脑,吃乌发粉;告别A罩杯,打造傲人丰姿,吃木瓜葛根茯苓粉……_xD_
近年来,在超市、农贸市场、网络上突然冒出许多有保健作用的养生粉,主要有两大类:一类是五谷杂粮为主的,有糙米、黑米、荞麦、燕麦、黄豆、红豆、绿豆、黑豆等品种;另一类是以常见的药食同源食材为主,有黑芝麻、核桃、莲子、山药、红枣、麦芽、茯苓、杏仁、薏米等品种."
2204,2204,2204,2204,2204,2204,"脂肪肝患者过冬季,饮食上切忌盲目进补",吕斌,,"对此,杨太太特地去医院请教老中医师,老中医师首先给杨太太解惑,再根据药食同源理论给杨太太支招——三步法:芝麻核桃加减法、临证膏方补治法、火锅底料食疗法,为她解除烦恼."
2205,2205,2205,2205,2205,2205,陕南人参菜优质高产栽培技术,陈益菊,"陕南,人参菜,栽培技术","陕南山区野生菜种类多,品质优良,膳食和药用价值高,具有药膳同源作用.人参菜属于其中一种,多年来一直没有开发利用,在陕南属于野生状态下生存,通过人工栽培驯化种植,提高其产量和品质,为人们膳食蔬菜增加一新的种类."
2206,2206,2206,2206,2206,2206,"养护生命,从日常饮食做起",叶青,,"若干年前在台湾考察学习,留存在记忆里的有一道菜,是在高雄一个小餐馆吃到的荆芥老鸭汤,大瓦罐的鸭汤上飘浮着碧绿芳香的荆芥叶,喝上一碗气血酣畅,疲乏顿消,记住这碗汤,也记住台湾人药材与食材的用心搭配._xD_
台湾的鸭汤让我念念不忘,我家老外婆的药食同源巧应用更是让我受益匪浅,值得分享.小时候,我体弱多病,经常干咳,打针吃药不见效,外婆让我把冰糖含在嘴里睡觉,说是外邪犯肺,冰糖能养阴生津,润肺止咳,那时能吮到冰糖也是开心事,糖汁浸润舌尖,十分甘甜,果然坚持两三夜干咳自愈."
2207,2207,2207,2207,2207,2207,大枣化学成分的研究进展,"刘世军,唐志书,崔春利,刘红波,梁艳妮,张娱,王梅","大枣,化学成分,进展",大枣为鼠李科植物枣（ZiziphusjujubaMill.）的干燥成熟果实，为药食同源的佳品，大枣性甘、温，归脾、胃经，具有补中益气、养血安神的功效。本文将近年来国内外对大枣化学成分的研究成果进行综述，为更好地研究、开发、利用大枣资源奠定基础。
2208,2208,2208,2208,2208,2208,山楂降血脂作用和机理研究进展,"王玲,吴军林,吴清平,万艳娟,张文","山楂,生物活性成分,降血脂作用","山楂为蔷薇科植物山里红(CrataeguspinnatifidaBge.var.majorN.E.Br.)或山楂(CrataeguspinnatifidaBge.)的干燥成熟果实.山楂中的降血脂活性物质包括总黄酮、三萜酸、植物甾醇、果胶五糖等,山楂与其他有效物质(如可用于保健食品的中药、药食同源的物质)联用能发挥更有效的降血脂作用.山楂通过提高胆固醇α-羟化酶的表达水平,抑制-羟基--甲基戊二酸单酰辅酶A还原酶、酰基辅酶A:胆固醇酰基转移酶的活性,增加低密度脂蛋白受体水平及通过调控多种脂肪代谢酶的机制调节血脂.本文阐述山楂活性物质的降血脂作用及山楂与其他有效物质联用的降血脂效果,并阐明山楂降血脂作用的机制,并对山楂的进一步研究进行展望."
2209,2209,2209,2209,2209,2209,骨质疏松的中医病因病机分析及其中医药治疗的前景探讨,"郭鱼波,王丽丽,马如风,赵丹丹,张东伟,陈家旭,牛建昭","骨质疏松,骨痿,脾虚,肾虚,肝虚,血瘀","骨质疏松是一种渐进性的代谢性疾病,中医认为肝脾肾的亏虚和血瘀均可诱发骨质疏松.其最主要病因是肾虚累及肝脾导致气血不足而血瘀,加上先天禀赋不足后天调养失宜致使筋脉失养骨枯髓减而致骨痿.本文详细地分析了中医对骨质疏松病因病机的认识,探索了中医药在治疗骨质疏松方面面临的机遇与挑战.中药的药食同源性和骨质疏松病程的长期性决定了中医药在治疗骨质疏松方面具有无可比拟的优势.而科学研究中医药,合理评价其安全性,是中医药发挥其临床治疗优势的关键."
2210,2210,2210,2210,2210,2210,北京市密云地区沙门菌喹诺酮耐药分子机制及同源性分析,"张巍巍,于兆阳,冯宝立,郑兰紫,蒋会婷","沙门菌,喹诺酮类,脉冲场凝胶电泳,耐药机制","目的了解北京市密云地区沙门菌的耐药特点和分子机制,并进行同源性分析.为沙门菌感染食源性疾病的防控提供科学依据.方法年分离食源性疾患患者的沙门菌共株,进行血清学鉴定和体外药敏试验,采用PCR扩增沙门菌的喹诺酮耐药区(QRDRs)基因(gyrA、gyrB、parC和parE),用脉冲场凝胶电泳(PFGE)检测菌株间的分子同源性.结果年密云地区沙门菌感染主要以鼠伤寒沙门菌和都柏林沙门菌为主,通过PFGE图谱分型并聚类分析,分别分成种和种型别,喹诺酮耐药率最高,并以位Asp→Tyr/Asn/Gly突变为主.结论密云地区食源性疾患患者沙门菌可能存在暴发,临床需谨慎使用喹诺酮类药物治疗沙门菌食源性疾患感染."
2211,2211,2211,2211,2211,2211,仲景妇人病用酒浅论,"曾斌,刘国伟,李大鹏,张希,吴生元,张晓琳","张仲景,妇人病,酒",酒作为药食同源之品，用途广泛。张仲景《伤寒杂病论》中多处涉及，在妇人三篇中的应用尤为集中。笔者通过对仲景在妇人病中的用酒经验进行研究，认为其对临床妇科病证的治疗有着重要的指导意义。
2212,2212,2212,2212,2212,2212,女贞子及其有效成分延缓衰老作用的研究进展,"刘静,赵海霞,袁丁,张长城","女贞子,衰老,抗氧化,抗炎,免疫调节,细胞凋亡,认知功能","衰老是机体随着年龄增加逐渐出现退行性变化的现象,是生命过程中的必然规律.衰老不能避免,但却可以延缓.探讨延缓衰老的方法,寻找有效延缓衰老的药物,已成为当前医学研究中的热点之一.女贞子是木犀科植物女贞的干燥成熟果实,含有萜类、黄酮类等多种活性成分,具有延缓衰老、免疫调节、改善认知功能等药理作用.已证实,女贞子及其有效成分能通过提高机体抗氧化能力、抗炎、增强免疫功能、抑制细胞凋亡等多种机制延缓衰老.文章综述了近年来女贞子及其有效成分延缓衰老的研究进展,以期为进一步完善女贞子延缓衰老的作用机制提供研究基础,为开发女贞子作为药食同源药材,用于保健品和新药研发提供理论依据和研究思路."
2213,2213,2213,2213,2213,2213,马齿苋的营养成分研究进展,"孙晓霞,王征帆,刘霞","马齿苋,营养成分,应用",马齿苋是一种野生药食同源植物，富含蛋白质、脂肪、纤维素、矿物质等多种营养物质，具有消炎抗菌、利水消肿、止血化瘀、清除尘毒等功效，具有广阔的应用和开发前景。本文对马齿苋中所含的营养成分进行综述，并对其开发应用前景进行展望。
2214,2214,2214,2214,2214,2214,西洋参连作障碍产生原因及生物防治概述,"王苗,孙燕,刘清梅,李治,韦梦成,赵芙蓉","西洋参,连作障碍,生物防治","西洋参是药食同源性食物,属名贵的高级保健品.但连作障碍带来的西洋参病虫害发生,使其品质下降,产量明显降低甚至绝产,因此连作障碍成为制约西洋参产业发展的主要阻力.该文通过挖掘资料文献,提出导致西洋参连作障碍的主要原因是自毒作用、根际微生态环境失衡以及病虫害增加个因素,对每一个因素进行深入论述,并探讨个因素之间的联系.最后提出通过生物防治手段解决西洋参连作障碍的可能性."
2215,2215,2215,2215,2215,2215,马齿苋粉成分分析及其在猪肉乳化香肠中的应用,"贾鸿茭,王稳航","马齿苋,膳食纤维,乳化香肠,功能性肉制品","马齿苋富含维生素、微量元素以及膳食纤维,是一种历史悠久的药食同源植物.经检测,马齿苋粉中总膳食纤维含量为.％±.％,粗蛋白为.％±.％、灰分为.％±.％.其吸水、吸油能力分别为(.±.)、(.±.)g/g.分别以％、％、％的比例将马齿苋粉添加到猪肉乳化香肠中,与空白组相比,随着马齿苋添加量的增加,香肠的蒸煮损失显著减小(p＜.);硬度、弹性、咀嚼性、粘聚性呈现先增大后减小的趋势;pH的变化不显著;香肠的亮度(L*)和红度(a*)显著降低(p＜.),黄度(b*)的变化不显著.由此,马齿苋粉可作为一种潜在的高膳食纤维配料,可应用于功能性肉制品的开发."
2216,2216,2216,2216,2216,2216,幼龄油茶林下套种平卧菊三七的试验研究,"王玉娟,杜人欢,聂韡,何小三","油茶,套种,平卧菊三七,土壤生态","针对于油茶幼林初期只投入无产出的实际问题,在油茶新造林开展套种药食同源植物平卧菊三七的试验研究,试验结果表明:油茶幼林套种平卧菊三七后,通过日常的精耕细作,使土壤的肥力和结构都得到很好的改善,全氮和水解氮的含量分别降低.%和.%;全磷降低%、有效磷增加.%;全钾增加.%、速效钾增加.%;有机质增加.%.土壤容重减少.%,总孔隙度增加.%,含水量增加.%.同时不会影响油茶的生长,既为油茶幼树的生长发育创造了良好环境,又能降低油茶幼林的养护成本."
2217,2217,2217,2217,2217,2217,益肾疏肝法在治疗慢性肾脏病中的应用,"周倩,孙鲁英","慢性肾脏病,肝肾同源,益肾疏肝法","慢性肾脏病(chronickidneydisease,CKD)是由于各种原因导致的肾损害(病理、血、尿、影像学异常)≥个月者.其治疗重点在于控制并发症和延缓疾病进展,中医药在治疗本病方面优势突出.根据CKD患者的临床症状,将其归属中医""慢肾风""""水肿""""癃闭""""关格""等范畴.《素问·脏气法时论篇》提出治疗肾病基本原则是""肾苦燥,急食辛以润之,开腠理,致津液,通气也""""肾欲坚,急食苦以坚之,用苦补之,咸泻之"".我们结合多年临床经验,认为CKD病位虽然主要在肾,但相当一部分患者伴有明显的肝气郁结的表现,如情绪低落、胸胁苦满、食欲下降、失眠等.肾者主水,主藏精,肝者主木,主藏血,水生木,精血同源,肝肾同源,在重视治疗本脏的同时,强调治疗相关的脏腑,坚持以益肾疏肝法治疗这类患者,常获良效.现总结如下,供同道参照."
2218,2218,2218,2218,2218,2218,枸杞及其提取物在肝病中应用的临床进展,"路宽,杨华升","枸杞,肝病,临床",枸杞是临床上常见的中药，且作为药食同源的植物，含有丰富的生物活性物质，如多糖、多肽等成分，在临床疾病的治疗中占据重要地位。研究表明枸杞具有抗衰老、抗氧化、抗肿瘤、降脂、降压、降糖及免疫调节等作用，同时枸杞也被广泛应用在各种肝病的治疗中。枸杞性平味甘，具有补益肝肾之功效，通过近几年相关文献研究发现，枸杞作为治疗肝病的常用药物，在临床治疗肝病中具有保肝等作用，并且在防治并发症等方面取得良好效果。枸杞治疗肝病在临床具有广阔的前景，可进行进一步研究，为中医防治肝病及其并发症提供更好临床思路。
2219,2219,2219,2219,2219,2219,脉冲场凝胶电泳技术在一起食物中毒中的应用,"马鑫,于烽,刘艳,苏静,远雪梅,雒婉霞","食物中毒,肠炎沙门菌,耐药性,脉冲场凝胶电泳","目的利用沙门菌分子分型技术,分析不同来源的菌株之间的遗传相关性,通过同源性分析追溯新疆某县一起食物中毒发生的原因.方法对样品进行培养获得株疑似沙门菌.通过脉冲场凝胶电泳(PFGE)技术对菌株进行鉴定及分子溯源.结果份患者粪便标本中有份分离到菌株,份食品样品中有份分离到菌株.株菌株初步生化鉴定结果为TSI(K/A)、产气、HS:+;赖氨酸脱梭酶:+;血清学分型结果相同,均为O:::+;H:g:m:+;H相:-,鉴定为肠炎沙门菌.药敏检测结果显示对四环素等种药物％敏感,对萘啶酸％耐药.PFGE分子分型及同源性分析,株肠炎沙门菌的DNA图谱完全相同.结论株肠炎沙门菌株的DNA图谱％同源,确认为一起由肠炎沙门菌污染了食品而引起的食物中毒."
2220,2220,2220,2220,2220,2220,石榴抗肿瘤有效成分的研究进展,"谢莉,田莉","石榴,抗肿瘤,有效成分","石榴为药食同源的药材,具有抗肿瘤、抗炎、抗氧化、降血糖、降血压及预防心脑血管疾病等多种药理和生理作用.因此,近年来对石榴的研究与探索越来越受到世界各国相关领域的重视.在我国石榴栽培历史悠久,资源丰富,但目前国内学者对石榴的研究大多都集中在石榴多酚类或黄酮类的提取工艺报道、化学成分分离和体外药理作用等方面,对石榴中单体化合物抗肿瘤的研究方面报道较少.石榴中存在多种药效活性成分,包括鞣花酸、安石榴苷、没食子酸、石榴皮鞣素、石榴酸等.本文对其抗肿瘤作用药效成分单体化合物的研究进展进行了综述,以期为石榴抗肿瘤作用的后续研究提供参考."
