,Unnamed: 0,Unnamed: 0.1,Unnamed: 0.1.1,Unnamed: 0.1.1.1,Unnamed: 0.1.1.1.1,篇名,作者,关键词,摘要
1440,1440,1440,1440,1440,1440,斯皮诺素磷脂复合物的制备及表征,"宋盼盼,朱杨军,张彦青,解军波","斯皮诺素,磷脂复合物,Box-Behnken设计法,表征","此研究旨在制备斯皮诺素磷脂复合物(SPI-PLC)并对其进行表征,为开发一种新型的药食同源的天然镇静催眠药物剂型及工业化生产辅以理论基础.采用溶剂挥发法制备SPI-PLC,以斯皮诺素与磷脂的复合率(CR)为质量评价指标,应用单因素实验和Box-Behnken设计-响应面法优化制备工艺;应用紫外光谱(UV)和红外光谱(IR)分析表征目标复合物是否形成,并考察其表观油水分配系数、粒径及分散程度.结果表明,制备SPI-PLC的最佳工艺条件为丙酮作反应溶剂,药脂比为:.,搅拌速度、反应温度和反应时间分别为r/min、℃和.h,复合率可达.％±.％,UV和IR分析表明斯皮诺素与磷脂并非是简单的物理混合,而是形成了磷脂复合物;在水中复合物粒径为(.±.)nm,多分散指数(PDI)为.±.;SPI-PLC的表观油水分配系数增大,具有一定的增溶作用.本研究成功制备了SPI-PLC,工艺简单可行,为斯皮诺素的制剂学研究及后期如何提高生物利用度提供了参考."
1441,1441,1441,1441,1441,1441,山楂的化学成分及药理作用研究进展,"牛喜香,陈蜜蜜,于怀华","山楂,化学成分,药理作用","山楂为药食同源植物,含有黄酮类、黄烷及其聚合物类、三萜类和有机酸类等多种化学成分,主要具有降血脂、保肝、降压、助消化、强心、抗氧化、抗肿瘤、抗菌等作用,应用十分广泛.对山楂化学成分和药理作用进行综述,为山楂进一步开发利用及其质量控制的研究提供参考依据."
1442,1442,1442,1442,1442,1442,苏州市食源性金黄色葡萄球菌耐药分析及基因分型,"王小龙,崔家瑞,朱莉勤,邹文燕,汤全英,张梦寒","食源性金黄色葡萄球菌,药物敏感试验,脉冲场凝胶电泳,分子分型","目的对苏州市～年分离的食源性金黄色葡萄球菌进行耐药谱和分子分型分析,初步建立PFGE(pulsed-fieldgelelectrophoresis)分型数据库.方法采用微量肉汤稀释法检测金黄色葡萄球菌(Staphylococcusaureus,SAU)对种常用的抗生素的耐药性,采用SmaI进行酶切,脉冲场凝胶电泳进行分子分型.菌株指纹图谱用BioNumericsv.软件进行分析.结果株SAU中检出株耐甲氧西林金黄色葡萄球菌(methicillin-resistanceStaphylococcusaureus,MRSA),检出率.％.有株菌存在不同程度的耐药,耐药率达到.％,其中对青霉素的耐药率最高(.％),其次是氨苄西林(.％),其后是克林霉素和红霉素(均为.％).耐受种和种以上药物的多重耐药菌株共株,多重耐药率达.％.MRSA的多重耐药率高于甲氧西林敏感型金黄色葡萄球菌(methicillin-sensitiveStaphylococcusaureus,MSSA),差异具有统计学意义(P＜.).除株菌不可被PFGE分型外,其余株菌可以被分为个不同型别,其中有个优势型别共株菌,在可分型菌株中占比达.％.这些同源菌株分离自不同时间和地点,有些还存在一定程度的变异.结论食源性金黄色葡萄球菌耐药现象普遍存在,多重耐药率较高,PFGE型别较为多样但有优势型别存在,耐药谱和PFGE型别关联性较差."
1443,1443,1443,1443,1443,1443,呼伦贝尔市首例羊源荚膜D群多杀性巴氏杆菌的分离与鉴定,"王巍,乌云塔娜,格根塔娜,刘连发,田宗民,邱凯,苏日古格,贾长生,王冠玉,赵忠武","羊,多杀性巴氏杆菌,PCR,药敏试验","为了确定呼伦贝尔市两个羊场的羊只出现体温升高、精神沉郁、食欲废绝、咳嗽、腹泻甚至死亡病因,本研究以病羊病变组织为研究对象,采用常规细菌培养法和多杀性巴氏杆菌种特异性基因KMT引物以及capA、capB、capD、capE、capF荚膜血清型特异性基因引物进行双重PCR扩增,确定分离菌的荚膜血清型,同时应用纸片扩散法对分离菌进行药物敏感性试验.结果显示:从病变的肺组织中分离到株菌落为灰白色、露珠状、不溶血,革兰氏染色阴性球状短杆菌;通过序列比对及遗传进化树分析,该分离株与印度分离株巴氏杆菌同源性高达％;本研究只扩增出多杀性巴氏杆菌荚膜血清D群;分离菌株对青霉素、复方新诺明、克林霉素等耐药,对诺氟沙星、卡那霉素、环丙沙星等药物已不敏感.本研究结果表明,我们首次从呼伦贝尔市病羊体内分离到荚膜血清D群多杀性巴氏杆菌."
1444,1444,1444,1444,1444,1444,名老中医罗笑容治疗儿科急症经验采撷,"胡彬文,许楷斯,杨京华","名老中医,罗笑容,岭南医学,儿科急症","介绍广东省名老中医罗笑容教授在小儿急症治疗方面的学术见解与风格.善用经方止咳喘、自拟效方治肠炎,巧用颗粒增依从,针药并用见奇效,药食同源重培土,内药外用止腹痛."
1445,1445,1445,1445,1445,1445,“消脂健胃”山黄皮果,陆小鸿,,"山黄皮树是亚热带珍稀的野生植物,其果实为我国南力所特有的优稀水果之一.山黄皮果可口美味,香气及酸甜味在芸香科水果中独具一格,民间有“果香奇特赛榴莲,消脂健胃壮美人”的美誉它药食同源,可鲜食、调味、入药,有消暑消炎、化滞祛湿、消脂化食、健脾益胃等功效入药的山黄皮果能疏风清热、利湿解毒、行气止痛等,主治感冒发热、咳嗽气喘、腹泻痢疾、风湿骨痛、胃肠炎等病症."
1446,1446,1446,1446,1446,1446,“坐月子”之药膳食疗,"范文昌,蔡丽华,莫妙玲,梅全喜","药膳,月子,产后病,辨证施膳","改变传统“一天一鸡”的月子饮食方式,多样化丰富产妇的一日三餐,不仅色香味俱全,并能防治产后病的出现.从食材、药食同源、药材、药膳方等方面进行归类分析,结合临床感官评定结果,观察其疗效及反馈.结果发现,产后病的发生多与出血过多、元气受损、瘀血内阻等因素有关,而药膳食疗则是寓医于食,可以发挥中医传统辨证论治及道地性药材的优势,辨证施膳,提高“坐月子”的生活质量."
1447,1447,1447,1447,1447,1447,尤昭玲巧用药膳治疗不孕症经验介绍,"杨永琴,魏本君,杨硕,申剑","不孕症,药膳,经验介绍,尤昭玲","《内经》曰:“五谷为养,五果为助,五畜为益,五蔬为充,气味合而服之,以补益精气”.“大毒治病,十去其六;常毒治病,十去其七;小毒治病,十去其八;无毒治病,十去其九;谷肉果菜,食养尽之,无使过之,伤其正也”.唐·孙思邈:“安身之本,必资于食;救疾之速,必凭于药.不知食宜者,不足以存生也;不明药忌者,不能以除病也……夫为医者,当须先洞晓病源,知其所犯,以食治之,食疗不愈,然后命药.”“食能排邪而安脏腑,悦脾爽志以资气血”,金元四大家之一的李东垣“药借食威,食助药力”,也道出了“药食同源”并非“药食无别”的观念.尤昭玲教授系湖南中医药大学博士研究生导师,国家第四批名老中医,从事中医和中西医结合妇产科临床、教学、科研工作余年,在中医妇科领域造诣颇深,擅长治疗妇科疑难杂症.尤教授秉承中医经典理论及古人圣贤之论,同时根据人的五行之分、九种体质之别、脏腑五行之属,食物有五色、五味之分,根据女性的特殊生理体质,食疗妇科疾病颇有心得.笔者有幸跟师学习,现将其食疗协助诊治不孕症的经验分享如下."
1448,1448,1448,1448,1448,1448,韭菜产业食品安全的影响因素及优化建议,"王利亚,张明,张亚丽,张华敏,胡超,李蕴莹","韭菜,食品安全,虫害,病害,杂草,化肥施用","韭菜是食药同源的的蔬菜,深受百姓喜爱.近年来,韭菜生产上病虫害流行速度快、草害猖獗、农药残留超标、化肥超量施用导致硝酸盐积累等因素严重威胁韭菜产业食品安全.笔者从虫害、病害、草害、化肥不合理施用等方面研究分析韭菜产业食品安全面临的不利因素,并针对这些问题从韭菜品种培育、育苗方式、化肥使用、农业栽培方式和病虫害综合防治等方面提出提高韭菜食品安全的优化建议,促进韭菜产业健康发展."
1449,1449,1449,1449,1449,1449,一起由金黄色葡萄球菌及其肠毒素引发食物中毒的实验室检测与分析,"栾阳,张晔,张金,黄河清,王增国","金黄色葡萄球菌,食物中毒,肠毒素,脉冲场凝胶电泳","目的查明引发食物中毒的致病菌,运用基因分型技术对致病菌进行溯源分析,为食物中毒诊断提供依据.方法采用食品安全国家GB系列标准方法对致病菌进行分离、鉴定.金黄色葡萄球菌肠毒素分型检测采用酶联免疫吸附法(ELISA),肠毒素基因的检测采用实时荧光定量PCR的方法,利用脉冲场凝胶电泳(Pulsed-fieldgelelectrophoresis,PFGE)进行同源性分析,全自动药敏接种判读仪(AIM-Vizion)进行耐药分析.结果份标本中都检测出金黄色葡萄球菌,株菌均产A型肠毒素,携带sea基因,剩余食物分离株与病人分离株PFGE带型相似性为.％,具有高度同源性,菌株对种抗生素耐药.结论本次食物中毒由肠毒素A型的金黄色葡萄球菌所致,实时荧光定量PCR可以弥补传统ELISA的不足.PFGE可迅速锁定传染源.提醒相关部门要加大合作和监督力度,保障食品安全."
1450,1450,1450,1450,1450,1450,山楂的生殖生物学和杂交育种研究进展,"杨明霞,杨萍,任瑞,崔克强,赵士粤,温映红","山楂,杂交育种,生殖生物学,授粉,遗传规律","山楂是著名的“药食同源”水果,在中国栽培历史悠久,但新品种多为芽变、实生选种等途径产生.为了探讨山楂杂交育种问题,本研究通过对国内外山楂的杂交育种方面的报道进行整理分析,详细介绍了山楂的开花生物学,花粉萌发规律,生殖生物学研究,杂交育种的必要性,育种方法及亲本选择,杂交育种遗传规律等方面的研究概况,并提出中国在山楂杂交育种研究领域的未来发展方向与新趋势,进而为今后相关研究工作提供理论依据."
1451,1451,1451,1451,1451,1451,“三七”之乡的产业扶贫经——云南省文山市财政支持产业扶贫显成效,"刘慧娴,余相权",,"“三七为传统名贵中药材,民间早就有了药食同源,古人誉为‘金不换’,《本草纲目》对其功效地位均有明确记载.多年来,文山人民栽培、种植这颗神草于此,文山市成为了三七的故乡.此地产量、产值均为全国第一、世界第一,文山市被命名为‘中国三七之乡’和‘全国三七产业知名品牌创建示范区’.”这是年月云南省文山市市长龚卿在中央电视台“厉害了我的国·中国电商扶贫行动”节目中的一段推介词."
1452,1452,1452,1452,1452,1452,雪莲果的研究进展,贠洁,"雪莲果,成分,药理","雪莲果是一种菊科多年生的草本植物,也是一种药食同源的食物,在研究大量的文献基础上,本文对对雪莲果的成分、药理、应用等方面进行综述,为进一步研究和发展提供资料."
1453,1453,1453,1453,1453,1453,响应曲面法优化苦丁茶总皂苷的提取工艺,"王玄源,时庆欣,刘梦君,向星亮,杨敏,计思敏,宋成武,黄荣增","苦丁茶,总皂苷,响应曲面法,提取工艺","目的:采用Box-Behnken响应曲面设计法确定苦丁茶总皂苷的最佳醇提工艺.方法:本研究在单因素实验的基础上,以药食同源中药苦丁茶中主要皂苷成分苦丁茶皂苷A(kudinosideA)为对照品,通过响应曲面法对影响苦丁茶中总皂苷得率的不同因素进行优化,以期研究乙醇提取苦丁茶总皂苷的工艺条件.结果:最佳提取工艺条件为加入乙醇浓度％,料液比∶,提取时间min.实验结果所得苦丁茶总皂苷得率为.％.结论:本实验结果与预测值高度拟合,为进一步开发和利用苦丁茶资源以及新药研发提供了科学依据."
1454,1454,1454,1454,1454,1454,周岱翰教授治疗胃癌临证经验,"戴黎颖,刘展华","胃癌,中医药疗法,经验总结,周岱翰","总结周岱翰教授治疗胃癌的临证经验.周教授认为胃癌的中医治疗注重顾护""胃气"",认为""有胃气则生,无胃气则死"";在保胃气方面,辨证论治,善用补气药;遣方用药时注重整体辨证,顾及旁脏;提倡""药食同源"",对胃癌患者的饮食调养应当辨证施膳."
1455,1455,1455,1455,1455,1455,痤疮人群中医辨证的饮食宜忌,"程桂真,韩倩倩","痤疮人群,辨证施护,饮食宜忌.","痤疮,又称""粉刺"",是青春期常见的与性激素分泌功能有关的毛囊皮脂腺慢性炎症,多发于头面部、颈部、前胸、后背皮脂腺发达的部位,临床表现黑头、丘疹、脓疱、结节、囊肿等损害.近年来发病率呈逐渐上升趋势,且治愈难度大、病程长、反复发生.而饮食失宜,过食肥甘厚味及辛辣等刺激性食物致使皮脂腺分泌过多而诱发或加重,多为本病发生的主要原因,所以对痤疮人群进行辨症施食、注意饮食宜忌非常重要,""药食同源"",《黄帝内经》指出:""大毒治病,十去其六……,谷肉果菜,食养尽之"".根据本人多年门诊对痤疮病人的辨证治护,分型为肺胃蕴热、脾胃湿热、痰瘀互结、阴虚火旺四种类型,分别进行辨治用药施食,注意饮食宜忌的健康指导,获效甚佳."
1456,1456,1456,1456,1456,1456,单宁酶处理对牛蒡提取物中抗氧化活性的影响,"王君,张新,张志萌,董自星,王正祥","牛蒡,单宁酶,抗氧化活性","牛蒡作为药食同源植物,具有较高的营养和保健价值.将单宁酶作用于新鲜牛蒡,通过对牛蒡提取物中总糖、总蛋白和总多酚含量的测定,以及抗氧化活性的考察,探讨了单宁酶在改善牛蒡提取物抗氧化活性的作用.研究结果表明,单宁酶可以显著提高提取物中总蛋白和总多酚含量,降低滤渣质量(P＜.).经单宁酶处理后,牛蒡提取物的清除DPPH和羟自由基能力以及总抗氧化能力均有显著性提高(P＜.),说明单宁酶可显著提高牛蒡提取物的抗氧化活性.该研究为单宁酶在牛蒡根深加工行业中的应用提供一定的理论依据."
1457,1457,1457,1457,1457,1457,对冕宁县刺梨产业发展的几点建议,"王小军,罗晓强,武紫娟",,"刺梨为蔷薇科多年生落叶丛生小灌木,是我国云贵高原和川西高原特有的野生经济植物资源.其根、茎、叶以及果实均具有独特的药用价值,尤其是果实中含有多种人体必需的氨基酸,维生素含量尤为丰富,是一种十分重要的药食同源植物."
1458,1458,1458,1458,1458,1458,晋绿号艺机一体化技术示范与推广应用,"刘支平,邢宝龙,杨芳","晋绿号,良繁,艺机一体化,示范推广","山西绿豆常年种植面积余万亩,占全省杂粮作物中杂豆种植面积(约万亩)的％,在我省杂豆生产中占有重要地位,极具开发推广潜力.随着山西农业供给侧结构改革、“农谷”建设及雁门关农牧交错区的大力推进与稳步发展,绿豆作为杂豆中抗旱最强、广适较好、营养最全面、功能最特、在山西各区被广泛种植的小杂粮作物,越来越引起人们的重视.绿豆既是燕山-太行山晋北六县贫困区农民赖以生存的经济作物,也是处于营养平衡膳食宝塔最低层的“三源、三养、三效”作物.绿豆全身都是宝,其籽粒药食同源、秸杆轮饲两用,根系固氮活土,幼苗培肥增绿.在山西晋北独特的地理、生态与旱作栽培条件下,大力发展山西晋北旱作绿豆的有机、艺机、功能化研发与集成示范,带动山西省绿豆的产业化、规模化发展,使山西晋北成为全国有机、特色、功能化绿豆的最重要原料出口供应地,对山西杂粮提质增效最具广阔的经济、社会和生态效益."
1459,1459,1459,1459,1459,1459,黄精茎点霉叶斑病菌的分离与鉴定,"邹娟,姚传威,邓波侠,李胜华,周准","黄精,草茎点霉,病原菌,ITS","黄精是重要的药食同源植物.从湖南洪江市采集的黄精叶斑病病叶上分离到一株真菌,经接种鉴定为黄精叶斑病的病原菌.从病原菌的培养性状和形态学特征、内转录区(ITS)和系统发育关系比较等方面进行了分析,结果表明:黄精叶斑病病原菌为草茎点霉(Phomaherbarum)."
1460,1460,1460,1460,1460,1460,CRISPR/Cas系统在丝状真菌中的研究进展,"王佩,刘文,沈祥陵","丝状真菌,CRISPR/Cas,基因编辑,生产应用","丝状真菌(Filamentousfungi)是一种与人类生存密切相关的微生物,除了具有巨大的食用和药用价值外,还被广泛应用于工业开发.近年来,成簇的规律间隔的短回文重复序列及其相关系统(Clusteredregulatoryinterspacedshortpalindromicrepeats-associatedprotein,CRISPR/Cas)以其设计简单、操作方便、精准定位、效率高等诸多优点在各个研究领域中迅速发展,并受到了国内外广泛关注,但由于某些真菌如烟曲霉中极低的同源重组率等,使得对其进行遗传操作相对困难,因而该技术在丝状真菌尤其是大型真菌中的应用鲜少.从CRISPR/Cas技术入手,结合该技术在丝状真菌研究领域的最新应用和研究进展,对其在丝状真菌中实现编辑的各种机制做了详细介绍,并重点分析了其在各类已报道的模式真菌中的应用,旨在为更多真菌实现基因编辑提供参考."
1461,1461,1461,1461,1461,1461,薏仁碎米酱油制曲工艺的优化,"张丽,卢红梅,陈莉,常冬妹","薏仁碎米,酱油,制曲,蛋白酶酶活力","随着人们对营养与健康的重视,薏仁米作为药食同源的优质禾谷类食品,越来越受到人们的追捧.而薏仁米在加工过程中会产生大量的薏仁碎米,薏仁碎米具有与薏仁米接近的营养价值,不充分利用将造成薏仁米资源的浪费.酱油制曲中以薏仁碎米为淀粉质原料,对豆粕与薏仁碎米添加比例、米曲霉接种量、制曲温度、制曲时间等进行薏仁碎米酱油制曲工艺的优化.在单因素试验的基础上,通过响应面分析法,以蛋白酶酶活力为判定指标,最终确定的最佳制曲工艺条件为豆粕与薏仁碎米比例:、米曲霉接种量.％、制曲时间.h、制曲温度.℃,蛋白酶活可达到.U/g,略低于常用的豆粕麸皮酱油曲(优化后蛋白酶活达.U/g),说明将薏仁碎米用于酱油酿造是可行的."
1462,1462,1462,1462,1462,1462,逆流色谱在人参属植物成分分离中的研究进展,"朱晓萌,孔蒙,刘代成,宋祥云,朱姮,王岱杰","逆流色谱,人参属植物,保健食品,研究进展","逆流色谱(CCC)技术在世纪年代由Ito博士创立,近年来,已逐渐成为化合物分离和制备的常用手段,特别是在天然产物研究领域应用日益广泛.人参属植物是名贵的药用植物,富含皂苷等活性成分,不仅是重要的中药资源,目前也越来越多地作为新资源食品或药食同源植物用于食品及保健品的生产,其中活性成分的分离是进一步深入研究及开发应用的基础.文章对逆流色谱技术在人参属植物活性成分分离的成果与进展进行了综述和总结."
1463,1463,1463,1463,1463,1463,山楂药材质量标准研究进展,"石晓晨,张玉,马云,席晓志,张永清,李佳","山楂,标准沿革,规格等级,影响因素,鉴别,含量测定","山楂作为一种药食同源的药材,临床上有非常广泛的应用,其质量的优劣直接影响临床治疗的效果,该文对山楂药材从质量标准沿革、影响因素及鉴别与含量测定的研究三方面作一综述,指出存在的问题,以期为山楂质量标准的完善和规范提供依据."
1464,1464,1464,1464,1464,1464,玛咖多糖的研究进展,"王宏慧,李翠翠,罗双群,任亚敏,方爱丽","玛咖,多糖,提取工艺,化学结构,生理功能","玛咖具有丰富的营养价值和药用功效,是不可缺少的药食同源型植物.对玛咖多糖的提取工艺、化学结构及生理功能进行介绍,重点对玛咖多糖的抗衰老、提高生育能力、调节免疫力、抗氧化、抗疲劳及抗肝损伤等生理功能进行论述,并指出玛咖多糖未来的发展方向."
1465,1465,1465,1465,1465,1465,海南木兰科植物抗菌性初探,"闫浩,牟玉兰,喻彦,刘朋军","苦梓,抗菌性,防腐剂","自然界中许多植物具有抗菌作用或抑菌作用,近年来国内外对植物源及药食同源防腐剂的研究十分活跃,该文以超声波提取法提取了海南木兰科植物苦梓含笑叶片中的有效成分.通过滤纸片扩散法验证了苦梓含笑叶提取物对大肠杆菌、金黄色葡萄球菌、沙门氏菌生长的抑制效果,其MIC分别为.％、.％、.％.该文研究内容为苦梓含笑的保护性育种及繁殖提供了价值依据,是对国家林木种质资源平台中关于该植物成分、功能的重要补充,填补了关于该植物化学成分记载的空白,也为以该植物叶为原料开发医药、化工、食品等领域新产品提供了理论依据."
1466,1466,1466,1466,1466,1466,舌尖上的杂交构树,胡艳敏,,"中国美食文化博大精深,构树入食入药已有几千年的历史,三国时期就有食用构树嫩叶的记载.构树食品不仅美味,更是具有医疗保健的功效.《本草蒙筌》记载构树有养生美容、延缓衰老的功效,是不可多得的天然保健品,与中医药学药食同源的基础理论以及现代人体营养学不谋而合."
1467,1467,1467,1467,1467,1467,公丁香生物活性的研究进展,"栾剑,孙贺,范影影,程云清","公丁香,丁香酚,生物活性","桃金娘科植物丁香(Syzygiumaromaticum)是名贵的香料和常见的中药材,在我国具有悠久的栽培和使用的历史,具有广泛的生物活性和良好的应用前景,在卫生部公布的种药食同源原料中位列第一.公丁香主要的功效成分为丁香酚(Eugenol),因其药理作用极其广泛,在药物和农业等领域都有较为广泛的应用.此外,公丁香提取物作为纯天然无毒性且功能稳定的天然产物,具有优良的抗氧化、抗菌等生物学特性,是开发利用新型的天然食品抗氧化剂、防腐剂等的理想材料.因此,研究公丁香的生物活性,为更进一步的开发公丁香的应用价值以及扩大其应用领域方面提供了极有价值的参考."
1468,1468,1468,1468,1468,1468,冀北山区北苍术栽培技术研究,谭文文,"北苍术,栽培技术,田间管理,采收加工","近年来随着人们生活水平的提高,北苍术作为一种药食同源的本草药品,得到人们的广泛关注.目前,冀北山区北苍术野生资源越来越少,人工栽培面积虽然因市场需求而不断扩大,但仍然有许多种植户因栽培技术不到位,管理宽泛,而导致产量较低,收入较少.根据冀北山区的气候特点和北苍术的生长习性,总结了北苍术绿色栽培技术,主要从土地选择、整理和施肥、育苗、田间管理、病虫害防治、采收等方面进行详解,以期为本地区的北苍术药材生产提提供技术指导."
1469,1469,1469,1469,1469,1469,百合磷茎中RegalosideA、AcetylregalosideC与RegalosideB高速逆流色谱分离及生物活性研究,"陆英,刘仲华,肖文军,傅冬和,谢红旗,曾建国","分离,中药百合,酚酸甘油酯苷,高速逆流色谱(HSCCC),生物活性","建立了高速逆流色谱分离制备药食同源植物百合磷茎中个酚酸甘油酯苷的方法,同时测定了化合物对,-二苯基--三硝基苯肼(DPPH)自由基的清除作用、脂质的过氧化抑制作用及对α-淀粉酶活性的促进作用.以乙酸乙酯-正丁醇-水(.％乙酸,∶.∶,体积比)为溶剂系统,上相为固定相,下相为流动相,从mg百合磷茎提取物中分离得到.mg纯度为.％的化合物,.mg纯度为.％的化合物,.mg纯度为.％的化合物.经质谱及核磁共振鉴定化合物～分别为王百合苷A(RegalosideA)、乙酰化王百合苷C(AcetylregalosideC)、王百合苷B(RegalosideB);活性研究表明,AcetylregalosideC对DPPH自由基清除作用及脂质过氧化抑制作用均最强,RegalosideA与RegalosideB对DPPH自由基清除作用很弱,对脂质过氧化有一定的抑制作用且相近,化合物抗氧化作用强弱为:化合物＞≈.化合物在不同浓度下对α-淀粉酶活性的促进作用具有一定差异,但化合物间无显著差异."
1470,1470,1470,1470,1470,1470,无花果的保鲜技术研究进展,"任小娜,王晓菡,夏娜,曾俊","无花果,物理保鲜,化学保鲜,生物保鲜,营养价值","无花果是一种药食同源的天然食品,具有很高的营养与药用价值,但采摘后易腐烂且难储存.详细介绍无花果保鲜技术的研究现状,为后续的研究提供参考,并对无花果保鲜技术的发展进行展望."
1471,1471,1471,1471,1471,1471,柴达木构杞促进运动员低氧适应能力的研究,樊蓉芸,"柴达木枸杞,高原训练,低氧适应","青藏高原特有植物抗缺氧、抗氧化、抗疲劳的功效日益得到重视和应用.本研究将药食同源的青海柴达木枸杞应用于竞技体育高原训练实践中,结果表明世居平原运动员在青海高原训练期间出现AMS分值增加、SpO和肺活量下降、反应时延长、体内脂肪量和体脂率下降等对高原环境与运动重叠缺氧的不适现象,而服用柴迭木枸杞有助于减缓AMS发生率和症状、增加能量储备、增长SpO和肺活量、缩短反应时,有助于提升平原运动员对高原低氧和高原训练的适应能力."
